"quoteID","quoteText","subQuotationList","quoteByteSpans","speaker","addressees","quoteType","referringExpression","mentionTextsList","mentionSpansList","mentionEntitiesList"
"Q638","I shall not say that you are mistaken, because you could
not really believe me to entertain any design of alarming you; and I
have had the pleasure of your acquaintance long enough to know, that you
find great enjoyment in occasionally professing opinions which in fact
are not your own.","['I shall not say that you are mistaken,', 'because you could\nnot really believe me to entertain any design of alarming you; and I\nhave had the pleasure of your acquaintance long enough to know, that you\nfind great enjoyment in occasionally professing opinions which in fact\nare not your own.']","[[305567, 305605], [305620, 305868]]","Mr. Darcy","['Elizabeth', 'Colonel Fitzwilliam']","Anaphoric","he replied","[['you'], ['you', 'you', 'your', 'you', 'your']]","[[[305588, 305591]], [[305628, 305631], [305696, 305699], [305732, 305736], [305776, 305779], [305859, 305863]]]","[[['Elizabeth']], [['Elizabeth'], ['Elizabeth'], ['Elizabeth'], ['Elizabeth'], ['Elizabeth']]]"
"Q639","Your cousin will give you a very pretty notion of
me, and teach you not to believe a word I say. I am particularly unlucky
in meeting with a person so well able to expose my real character, in a
part of the world, where I had hoped to pass myself off with some degree
of credit. Indeed, Mr. Darcy, it is very ungenerous in you to mention
all that you knew to my disadvantage in Hertfordshire--and, give me
leave to say, very impolitic too--for it is provoking me to retaliate,
and such things may come out, as will shock your relations to hear.","['Your cousin will give you a very pretty notion of\nme, and teach you not to believe a word I say. I am particularly unlucky\nin meeting with a person so well able to expose my real character, in a\npart of the world, where I had hoped to pass myself off with some degree\nof credit. Indeed, Mr. Darcy, it is very ungenerous in you to mention\nall that you knew to my disadvantage in Hertfordshire--and, give me\nleave to say, very impolitic too--for it is provoking me to retaliate,\nand such things may come out, as will shock your relations to hear.']","[[305960, 306504]]","Elizabeth","['Mr. Darcy', 'Colonel Fitzwilliam']","Explicit","Elizabeth laughed heartily at this picture of herself and said to Colonel Fitzwilliam","[['Your cousin', 'you', 'you', 'Mr. Darcy', 'you', 'you']]","[[[305960, 305971], [305982, 305985], [306024, 306027], [306247, 306256], [306283, 306286], [306307, 306310]]]","[[['Mr. Darcy'], ['Colonel Fitzwilliam'], ['Colonel Fitzwilliam'], ['Mr. Darcy'], ['Mr. Darcy'], ['Mr. Darcy']]]"
"Q640","I am not afraid of you,","['I am not afraid of you,']","[[306508, 306531]]","Mr. Darcy","['Elizabeth', 'Colonel Fitzwilliam']","Anaphoric","said he","[['you']]","[[[306527, 306530]]]","[[['Elizabeth']]]"
"Q641","Pray let me hear what you have to accuse him of, I should like to know how he behaves among strangers.","['Pray let me hear what you have to accuse him of,', 'I should like to know how he behaves among strangers.']","[[306555, 306603], [306633, 306686]]","Colonel Fitzwilliam","['Mr. Darcy', 'Elizabeth']","Explicit","cried Colonel Fitzwilliam","[['you', 'him'], ['he']]","[[[306577, 306580], [306596, 306599]], [[306659, 306661]]]","[[['Elizabeth'], ['Mr. Darcy']], [['Mr. Darcy']]]"
"Q642","You shall hear then--but prepare yourself for something very dreadful.
The first time of my ever seeing him in Hertfordshire, you must know,
was at a ball--and at this ball, what do you think he did? He danced
only four dances! I am sorry to pain you--but so it was. He danced only
four dances, though gentlemen were scarce; and, to my certain knowledge,
more than one young lady was sitting down in want of a partner. Mr.
Darcy, you cannot deny the fact.","['You shall hear then--but prepare yourself for something very dreadful.\nThe first time of my ever seeing him in Hertfordshire, you must know,\nwas at a ball--and at this ball, what do you think he did? He danced\nonly four dances! I am sorry to pain you--but so it was. He danced only\nfour dances, though gentlemen were scarce; and, to my certain knowledge,\nmore than one young lady was sitting down in want of a partner. Mr.\nDarcy, you cannot deny the fact.']","[[306690, 307145]]","Elizabeth","['Mr. Darcy', 'Colonel Fitzwilliam']","Implicit","nan","[['You', 'yourself', 'him', 'you', 'you', 'he', 'He', 'you', 'He', 'Mr.\nDarcy', 'you']]","[[[306690, 306693], [306723, 306731], [306794, 306797], [306816, 306819], [306872, 306875], [306882, 306884], [306890, 306892], [306937, 306940], [306957, 306959], [307109, 307118], [307120, 307123]]]","[[['Colonel Fitzwilliam'], ['Colonel Fitzwilliam'], ['Mr. Darcy'], ['Colonel Fitzwilliam'], ['Colonel Fitzwilliam'], ['Mr. Darcy'], ['Mr. Darcy'], ['Colonel Fitzwilliam'], ['Mr. Darcy'], ['Mr. Darcy'], ['Mr. Darcy']]]"
"Q643","I had not at that time the honour of knowing any lady in the assembly
beyond my own party.","['I had not at that time the honour of knowing any lady in the assembly\nbeyond my own party.']","[[307149, 307239]]","Mr. Darcy","['Elizabeth', 'Colonel Fitzwilliam']","Implicit","nan","[[]]","[[]]","[[]]"
"Q644","True; and nobody can ever be introduced in a ball room. Well, Colonel
Fitzwilliam, what do I play next? My fingers wait your orders.","['True; and nobody can ever be introduced in a ball room. Well, Colonel\nFitzwilliam, what do I play next? My fingers wait your orders.']","[[307243, 307375]]","Elizabeth","['Mr. Darcy', 'Colonel Fitzwilliam']","Implicit","nan","[['Colonel\nFitzwilliam', 'your']]","[[[307305, 307324], [307363, 307367]]]","[[['Colonel Fitzwilliam'], ['Colonel Fitzwilliam']]]"
"Q645","Perhaps, I should have judged better, had I sought an
introduction, but I am ill qualified to recommend myself to strangers.","['Perhaps,', 'I should have judged better, had I sought an\nintroduction, but I am ill qualified to recommend myself to strangers.']","[[307379, 307387], [307402, 307517]]","Mr. Darcy","['Elizabeth', 'Colonel Fitzwilliam']","Explicit","said Darcy","[[], []]","[[], []]","[[], []]"
"Q646","Shall we ask your cousin the reason of this? Shall we ask him why a man of sense and
education, and who has lived in the world, is ill qualified to recommend
himself to strangers?","['Shall we ask your cousin the reason of this?', 'Shall we ask him why a man of sense and\neducation, and who has lived in the world, is ill qualified to recommend\nhimself to strangers?']","[[307521, 307565], [307622, 307756]]","Elizabeth","['Mr. Darcy', 'Colonel Fitzwilliam']","Explicit","said Elizabeth still addressing Colonel Fitzwilliam","[['we', 'your cousin'], ['we', 'him']]","[[[307527, 307529], [307534, 307545]], [[307628, 307630], [307635, 307638]]]","[[['Elizabeth', 'Colonel Fitzwilliam'], ['Darcy']], [['Elizabeth', 'Colonel Fitzwilliam'], ['Mr. Darcy']]]"
"Q647","I can answer your question, without applying to
him. It is because he will not give himself the trouble.","['I can answer your question,', 'without applying to\nhim. It is because he will not give himself the trouble.']","[[307760, 307787], [307808, 307884]]","Colonel Fitzwilliam","['Mr. Darcy', 'Elizabeth']","Explicit","said Fitzwilliam","[[], ['him', 'he']]","[[], [[307828, 307831], [307847, 307849]]]","[[], [['Mr. Darcy'], ['Mr. Darcy']]]"
"Q648","I certainly have not the talent which some people possess, of conversing easily with those I have never seen before. I cannot
catch their tone of conversation, or appear interested in their
concerns, as I often see done.","['I certainly have not the talent which some people possess,', 'of conversing easily with those I have never seen before. I cannot\ncatch their tone of conversation, or appear interested in their\nconcerns, as I often see done.']","[[307888, 307946], [307961, 308122]]","Mr. Darcy","['Elizabeth', 'Colonel Fitzwilliam']","Explicit","said Darcy","[[], []]","[[], []]","[[], []]"
"Q649","My fingers, do not move over this instrument in the
masterly manner which I see so many women's do. They have not the same
force or rapidity, and do not produce the same expression. But then I
have always supposed it to be my own fault--because I would not take the
trouble of practising. It is not that I do not believe _my_ fingers as
capable as any other woman's of superior execution.","['My fingers,', ""do not move over this instrument in the\nmasterly manner which I see so many women's do. They have not the same\nforce or rapidity, and do not produce the same expression. But then I\nhave always supposed it to be my own fault--because I would not take the\ntrouble of practising. It is not that I do not believe _my_ fingers as\ncapable as any other woman's of superior execution.""]","[[308126, 308137], [308156, 308532]]","Elizabeth","['Mr. Darcy', 'Colonel Fitzwilliam']","Explicit","said Elizabeth","[[], []]","[[], []]","[[], []]"
"Q650","You are perfectly right. You have employed your
time much better. No one admitted to the privilege of hearing you, can
think any thing wanting. We neither of us perform to strangers.","['You are perfectly right. You have employed your\ntime much better. No one admitted to the privilege of hearing you, can\nthink any thing wanting. We neither of us perform to strangers.']","[[308559, 308741]]","Mr. Darcy","['Elizabeth', 'Colonel Fitzwilliam']","Explicit","Darcy smiled and said","[['You', 'You', 'your', 'you', 'We', 'us']]","[[[308559, 308562], [308584, 308587], [308602, 308606], [308669, 308672], [308703, 308705], [308717, 308719]]]","[[['Elizabeth'], ['Elizabeth'], ['Elizabeth'], ['Elizabeth'], ['Mr. Darcy', 'Elizabeth'], ['Mr. Darcy', 'Elizabeth']]]"
"Q651","Miss Bennet would not play at all amiss, if she practised more, and
could have the advantage of a London master. She has a very good notion
of fingering, though her taste is not equal to Anne's. Anne would have
been a delightful performer, had her health allowed her to learn.","[""Miss Bennet would not play at all amiss, if she practised more, and\ncould have the advantage of a London master. She has a very good notion\nof fingering, though her taste is not equal to Anne's. Anne would have\nbeen a delightful performer, had her health allowed her to learn.""]","[[308967, 309243]]","Lady Catherine De Bourgh","['Mr. Darcy', 'Elizabeth', 'Colonel Fitzwilliam']","Explicit","Lady Catherine approached and after listening for a few minutes said to Darcy","[['Miss Bennet', 'she', 'She', 'her', 'Anne', 'Anne', 'her', 'her']]","[[[308967, 308978], [309011, 309014], [309080, 309083], [309128, 309131], [309154, 309158], [309162, 309166], [309211, 309214], [309230, 309233]]]","[[['Elizabeth'], ['Elizabeth'], ['Elizabeth'], ['Elizabeth'], ['Anne De Bourgh'], ['Anne De Bourgh'], ['Anne De Bourgh'], ['Anne De Bourgh']]]"
"Q652","How very suddenly you all quitted Netherfield last November, Mr. Darcy!
It must have been a most agreeable surprise to Mr. Bingley to see you
all after him so soon; for, if I recollect right, he went but the day
before. He and his sisters were well, I hope, when you left London.","['How very suddenly you all quitted Netherfield last November, Mr. Darcy!\nIt must have been a most agreeable surprise to Mr. Bingley to see you\nall after him so soon; for, if I recollect right, he went but the day\nbefore. He and his sisters were well, I hope, when you left London.']","[[310961, 311240]]","Elizabeth","['Mr. Darcy']","Anaphoric","she observed","[['Mr. Darcy', 'Mr. Bingley', 'him', 'he', 'He', 'you']]","[[[311022, 311031], [311080, 311091], [311113, 311116], [311153, 311155], [311181, 311183], [311224, 311227]]]","[[['Mr. Darcy'], ['Mr. Bingley'], ['Mr. Bingley'], ['Mr. Bingley'], ['Mr. Bingley'], ['Mr. Darcy']]]"
"Q653","Perfectly so--I thank you.","['Perfectly so--I thank you.']","[[311244, 311270]]","Mr. Darcy","['Elizabeth']","Implicit","nan","[['you']]","[[[311266, 311269]]]","[[['Elizabeth']]]"
"Q654","I think I have understood that Mr. Bingley has not much idea of ever
returning to Netherfield again?","['I think I have understood that Mr. Bingley has not much idea of ever\nreturning to Netherfield again?']","[[311359, 311459]]","Elizabeth","['Mr. Darcy']","Anaphoric","She found that she was to receive no other answerand after a short pause added","[['Mr. Bingley']]","[[[311390, 311401]]]","[[['Mr. Bingley']]]"
"Q655","I have never heard him say so; but it is probable that he may spend
very little of his time there in future. He has many friends, and he is
at a time of life when friends and engagements are continually
increasing.","['I have never heard him say so; but it is probable that he may spend\nvery little of his time there in future. He has many friends, and he is\nat a time of life when friends and engagements are continually\nincreasing.']","[[311463, 311677]]","Mr. Darcy","['Elizabeth']","Implicit","nan","[['him', 'he', 'his', 'He', 'he']]","[[[311482, 311485], [311518, 311520], [311546, 311549], [311572, 311574], [311597, 311599]]]","[[['Mr. Bingley'], ['Mr. Bingley'], ['Mr. Bingley'], ['Mr. Bingley'], ['Mr. Bingley']]]"
"Q656","If he means to be but little at Netherfield, it would be better for the
neighbourhood that he should give up the place entirely, for then we
might possibly get a settled family there. But perhaps Mr. Bingley did
not take the house so much for the convenience of the neighbourhood as
for his own, and we must expect him to keep or quit it on the same
principle.","['If he means to be but little at Netherfield, it would be better for the\nneighbourhood that he should give up the place entirely, for then we\nmight possibly get a settled family there. But perhaps Mr. Bingley did\nnot take the house so much for the convenience of the neighbourhood as\nfor his own, and we must expect him to keep or quit it on the same\nprinciple.']","[[311681, 312041]]","Elizabeth","['Mr. Darcy']","Implicit","nan","[['he', 'he', 'Mr. Bingley', 'his', 'him']]","[[[311684, 311686], [311772, 311774], [311877, 311888], [311968, 311971], [311996, 311999]]]","[[['Mr. Bingley'], ['Mr. Bingley'], ['Mr. Bingley'], ['Mr. Bingley'], ['Mr. Bingley']]]"
"Q657","I should not be surprised, if he were to give it up, as
soon as any eligible purchase offers.","['I should not be surprised,', 'if he were to give it up, as\nsoon as any eligible purchase offers.']","[[312045, 312071], [312086, 312152]]","Mr. Darcy","['Elizabeth']","Explicit","said Darcy","[[], ['he']]","[[], [[312089, 312091]]]","[[], [['Mr. Bingley']]]"
"Q658","This seems a very comfortable
house. Lady Catherine, I believe, did a great deal to it when Mr.
Collins first came to Hunsford.","['This seems a very comfortable\nhouse. Lady Catherine, I believe, did a great deal to it when Mr.\nCollins first came to Hunsford.']","[[312372, 312499]]","Mr. Darcy","['Elizabeth']","Anaphoric","He took the hint and soon began","[['Lady Catherine', 'Mr.\nCollins']]","[[[312409, 312423], [312464, 312475]]]","[[['Lady Catherine De Bourgh'], ['Mr. Collins']]]"
"Q659","I believe she did--and I am sure she could not have bestowed her
kindness on a more grateful object.","['I believe she did--and I am sure she could not have bestowed her\nkindness on a more grateful object.']","[[312503, 312603]]","Elizabeth","['Mr. Darcy']","Implicit","nan","[['she', 'she', 'her']]","[[[312513, 312516], [312536, 312539], [312564, 312567]]]","[[['Lady Catherine De Bourgh'], ['Lady Catherine De Bourgh'], ['Lady Catherine De Bourgh']]]"
"Q660","Mr. Collins appears very fortunate in his choice of a wife.","['Mr. Collins appears very fortunate in his choice of a wife.']","[[312607, 312666]]","Mr. Darcy","['Elizabeth']","Implicit","nan","[['Mr. Collins', 'his choice of a wife']]","[[[312607, 312618], [312645, 312665]]]","[[['Mr. Collins'], ['Charlotte Lucas']]]"
"Q661","Yes, indeed; his friends may well rejoice in his having met with one of
the very few sensible women who would have accepted him, or have made
him happy if they had. My friend has an excellent understanding--though
I am not certain that I consider her marrying Mr. Collins as the wisest
thing she ever did. She seems perfectly happy, however, and in a
prudential light, it is certainly a very good match for her.","['Yes, indeed; his friends may well rejoice in his having met with one of\nthe very few sensible women who would have accepted him, or have made\nhim happy if they had. My friend has an excellent understanding--though\nI am not certain that I consider her marrying Mr. Collins as the wisest\nthing she ever did. She seems perfectly happy, however, and in a\nprudential light, it is certainly a very good match for her.']","[[312670, 313081]]","Elizabeth","['Mr. Darcy']","Implicit","nan","[['his', 'his', 'him', 'My friend', 'her', 'Mr. Collins', 'she', 'She', 'her']]","[[[312683, 312686], [312715, 312718], [312794, 312797], [312835, 312844], [312917, 312920], [312930, 312941], [312962, 312965], [312976, 312979], [313077, 313080]]]","[[['Mr. Collins'], ['Mr. Collins'], ['Mr. Collins'], ['Charlotte Lucas'], ['Charlotte Lucas'], ['Mr. Collins'], ['Charlotte Lucas'], ['Charlotte Lucas'], ['Charlotte Lucas']]]"
"Q662","It must be very agreeable to her to be settled within so easy a
distance of her own family and friends.","['It must be very agreeable to her to be settled within so easy a\ndistance of her own family and friends.']","[[313085, 313188]]","Mr. Darcy","['Elizabeth']","Implicit","nan","[['her', 'her']]","[[[313114, 313117], [313161, 313164]]]","[[['Charlotte Lucas'], ['Charlotte Lucas']]]"
"Q663","An easy distance do you call it? It is nearly fifty miles.","['An easy distance do you call it? It is nearly fifty miles.']","[[313192, 313250]]","Elizabeth","['Mr. Darcy']","Implicit","nan","[['you']]","[[[313212, 313215]]]","[[['Mr. Darcy']]]"
"Q664","And what is fifty miles of good road? Little more than half a day's
journey. Yes, I call it a _very_ easy distance.","[""And what is fifty miles of good road? Little more than half a day's\njourney. Yes, I call it a _very_ easy distance.""]","[[313254, 313369]]","Mr. Darcy","['Elizabeth']","Implicit","nan","[[]]","[[]]","[[]]"
"Q665","I should never have considered the distance as one of the _advantages_
of the match, I should never have said Mrs. Collins
was settled _near_ her family.","['I should never have considered the distance as one of the _advantages_\nof the match,', 'I should never have said Mrs. Collins\nwas settled _near_ her family.']","[[313373, 313457], [313477, 313545]]","Elizabeth","['Mr. Darcy']","Explicit","cried Elizabeth","[[], ['Mrs. Collins', 'her']]","[[], [[313502, 313514], [313534, 313537]]]","[[], [['Charlotte Lucas'], ['Charlotte Lucas']]]"
"Q666","It is a proof of your own attachment to Hertfordshire. Any thing beyond
the very neighbourhood of Longbourn, I suppose, would appear far.","['It is a proof of your own attachment to Hertfordshire. Any thing beyond\nthe very neighbourhood of Longbourn, I suppose, would appear far.']","[[313549, 313686]]","Mr. Darcy","['Elizabeth']","Implicit","nan","[[]]","[[]]","[[]]"
"Q667","I do not mean to say that a woman may not be settled too near her
family. The far and the near must be relative, and depend on many
varying circumstances. Where there is fortune to make the expence of
travelling unimportant, distance becomes no evil. But that is not the
case _here_. Mr. and Mrs. Collins have a comfortable income, but not
such a one as will allow of frequent journeys--and I am persuaded my
friend would not call herself _near_ her family under less than _half_
the present distance.","['I do not mean to say that a woman may not be settled too near her\nfamily. The far and the near must be relative, and depend on many\nvarying circumstances. Where there is fortune to make the expence of\ntravelling unimportant, distance becomes no evil. But that is not the\ncase _here_. Mr. and Mrs. Collins have a comfortable income, but not\nsuch a one as will allow of frequent journeys--and I am persuaded my\nfriend would not call herself _near_ her family under less than _half_\nthe present distance.']","[[313868, 314369]]","Elizabeth","['Mr. Darcy']","Anaphoric","she answered","[['Mr. and Mrs. Collins', 'my\nfriend', 'her family']]","[[[314152, 314172], [314274, 314283], [314314, 314324]]]","[[['Charlotte Lucas', 'Mr. Collins'], ['Charlotte Lucas'], ['Maria', 'Sir William Lucas', 'Lady Lucas']]]"
"Q668","_You_ cannot
have a right to such very strong local attachment. _You_ cannot have
been always at Longbourn.","['_You_ cannot\nhave a right to such very strong local attachment. _You_ cannot have\nbeen always at Longbourn.']","[[314430, 314537]]","Mr. Darcy","['Elizabeth']","Explicit","Mr Darcy drew his chair a little towards her and said","[['You', 'You']]","[[[314431, 314434], [314495, 314498]]]","[[['Elizabeth'], ['Elizabeth']]]"
"Q669","Are you pleased with Kent?","['Are you pleased with Kent?']","[[314725, 314751]]","Mr. Darcy","['Elizabeth']","Anaphoric","he drew back his chair took a newspaper from the table and glancing over it said","[['you']]","[[[314729, 314732]]]","[[['Elizabeth']]]"
"Q670","What can be the meaning of this! My dear Eliza he must be in love with you, or he would never have
called on us in this familiar way.","['What can be the meaning of this!', 'My dear Eliza he must be in love with you, or he would never have\ncalled on us in this familiar way.']","[[315139, 315171], [315214, 315314]]","Charlotte Lucas","['Elizabeth', 'Maria']","Explicit","said Charlotte","[[], ['My dear Eliza', 'he', 'you', 'he', 'us']]","[[], [[315214, 315227], [315228, 315230], [315252, 315255], [315260, 315262], [315290, 315292]]]","[[], [['Elizabeth'], ['Mr. Darcy'], ['Elizabeth'], ['Mr. Darcy'], ['Elizabeth', 'Charlotte Lucas', 'Maria']]]"
"Q671","I did not know before that you ever walked this way.","['I did not know before that you ever walked this way.']","[[320166, 320218]]","Elizabeth","['Colonel Fitzwilliam']","Anaphoric","she said","[['you']]","[[[320193, 320196]]]","[[['Colonel Fitzwilliam']]]"
"Q672","I have been making the tour of the Park, as I generally
do every year, and intend to close it with a call at the Parsonage. Are
you going much farther?","['I have been making the tour of the Park,', 'as I generally\ndo every year, and intend to close it with a call at the Parsonage. Are\nyou going much farther?']","[[320222, 320262], [320277, 320387]]","Colonel Fitzwilliam","['Elizabeth']","Anaphoric","he replied","[[], ['you']]","[[], [[320364, 320367]]]","[[], [['Elizabeth']]]"
"Q673","No, I should have turned in a moment.","['No, I should have turned in a moment.']","[[320391, 320428]]","Elizabeth","['Colonel Fitzwilliam']","Implicit","nan","[[]]","[[]]","[[]]"
"Q674","Do you certainly leave Kent on Saturday?","['Do you certainly leave Kent on Saturday?']","[[320511, 320551]]","Elizabeth","['Colonel Fitzwilliam']","Anaphoric","said she","[['you']]","[[[320514, 320517]]]","[[['Colonel Fitzwilliam']]]"
"Q675","Yes--if Darcy does not put it off again. But I am at his disposal. He
arranges the business just as he pleases.","['Yes--if Darcy does not put it off again. But I am at his disposal. He\narranges the business just as he pleases.']","[[320565, 320676]]","Colonel Fitzwilliam","['Elizabeth']","Implicit","nan","[['Darcy', 'his', 'He', 'he']]","[[[320573, 320578], [320618, 320621], [320632, 320634], [320665, 320667]]]","[[['Mr. Darcy'], ['Mr. Darcy'], ['Mr. Darcy'], ['Mr. Darcy']]]"
"Q676","And if not able to please himself in the arrangement, he has at least
great pleasure in the power of choice. I do not know any body who seems
more to enjoy the power of doing what he likes than Mr. Darcy.","['And if not able to please himself in the arrangement, he has at least\ngreat pleasure in the power of choice. I do not know any body who seems\nmore to enjoy the power of doing what he likes than Mr. Darcy.']","[[320680, 320884]]","Elizabeth","['Colonel Fitzwilliam']","Implicit","nan","[['he', 'he', 'Mr. Darcy']]","[[[320734, 320736], [320860, 320862], [320874, 320883]]]","[[['Mr. Darcy'], ['Mr. Darcy'], ['Mr. Darcy']]]"
"Q677","He likes to have his own way very well, But so we all do. It is only that he has better means of having it than
many others, because he is rich, and many others are poor. I speak
feelingly. A younger son, you know, must be inured to self-denial and
dependence.","['He likes to have his own way very well,', 'But so we all do. It is only that he has better means of having it than\nmany others, because he is rich, and many others are poor. I speak\nfeelingly. A younger son, you know, must be inured to self-denial and\ndependence.']","[[320888, 320927], [320959, 321179]]","Colonel Fitzwilliam","['Elizabeth']","Explicit","replied Colonel Fitzwilliam","[['He', 'his'], ['he', 'he', 'you']]","[[[320888, 320890], [320905, 320908]], [[320993, 320995], [321052, 321054], [321124, 321127]]]","[[['Mr. Darcy'], ['Mr. Darcy']], [['Mr. Darcy'], ['Mr. Darcy'], ['Elizabeth']]]"
"Q678","In my opinion, the younger son of an Earl can know very little of
either. Now, seriously, what have you ever known of self-denial and
dependence? When have you been prevented by want of money from going
wherever you chose, or procuring any thing you had a fancy for?","['In my opinion, the younger son of an Earl can know very little of\neither. Now, seriously, what have you ever known of self-denial and\ndependence? When have you been prevented by want of money from going\nwherever you chose, or procuring any thing you had a fancy for?']","[[321183, 321449]]","Elizabeth","['Colonel Fitzwilliam']","Implicit","nan","[['you', 'you', 'you', 'you']]","[[[321283, 321286], [321339, 321342], [321395, 321398], [321429, 321432]]]","[[['Colonel Fitzwilliam'], ['Colonel Fitzwilliam'], ['Colonel Fitzwilliam'], ['Colonel Fitzwilliam']]]"
