"quoteID","quoteText","subQuotationList","quoteByteSpans","speaker","addressees","quoteType","referringExpression","mentionTextsList","mentionSpansList","mentionEntitiesList"
"Q906","Oh! my dear brother, that is exactly what I
could most wish for. And now do, when you get to town, find them out,
wherever they may be; and if they are not married already, _make_ them
marry. And as for wedding clothes, do not let them wait for that, but
tell Lydia she shall have as much money as she chuses, to buy them,
after they are married. And, above all things, keep Mr. Bennet from
fighting. Tell him what a dreadful state I am in,--that I am frightened
out of my wits; and have such tremblings, such flutterings, all over me,
such spasms in my side, and pains in my head, and such beatings at
heart, that I can get no rest by night nor by day. And tell my dear
Lydia, not to give any directions about her clothes, till she has seen
me, for she does not know which are the best warehouses. Oh, brother,
how kind you are! I know you will contrive it all.","['Oh! my dear brother,', 'that is exactly what I\ncould most wish for. And now do, when you get to town, find them out,\nwherever they may be; and if they are not married already, _make_ them\nmarry. And as for wedding clothes, do not let them wait for that, but\ntell Lydia she shall have as much money as she chuses, to buy them,\nafter they are married. And, above all things, keep Mr. Bennet from\nfighting. Tell him what a dreadful state I am in,--that I am frightened\nout of my wits; and have such tremblings, such flutterings, all over me,\nsuch spasms in my side, and pains in my head, and such beatings at\nheart, that I can get no rest by night nor by day. And tell my dear\nLydia, not to give any directions about her clothes, till she has seen\nme, for she does not know which are the best warehouses. Oh, brother,\nhow kind you are! I know you will contrive it all.']","[[507254, 507274], [507298, 508139]]","Mrs. Bennet","['Elizabeth', 'Mrs. Gardiner', 'Jane', 'Mr. Gardiner']","Explicit","replied Mrs Bennet","[['my dear brother'], ['you', 'them', 'they', 'they', 'them', 'them', 'Lydia', 'she', 'she', 'them', 'they', 'Mr. Bennet', 'him', 'my dear\nLydia', 'her', 'she', 'she', 'brother', 'you', 'you']]","[[[507258, 507273]], [[507359, 507362], [507381, 507385], [507400, 507404], [507420, 507424], [507457, 507461], [507508, 507512], [507537, 507542], [507543, 507546], [507575, 507578], [507594, 507598], [507606, 507610], [507652, 507662], [507683, 507686], [507940, 507953], [507988, 507991], [508006, 508009], [508027, 508030], [508080, 508087], [508098, 508101], [508114, 508117]]]","[[['Mr. Gardiner']], [['Mr. Gardiner'], ['George Wickham', 'Lydia'], ['George Wickham', 'Lydia'], ['George Wickham', 'Lydia'], ['George Wickham', 'Lydia'], ['George Wickham', 'Lydia'], ['Lydia'], ['Lydia'], ['Lydia'], ['George Wickham', 'Lydia'], ['George Wickham', 'Lydia'], ['Mr. Bennet'], ['Mr. Bennet'], ['Lydia'], ['Lydia'], ['Lydia'], ['Lydia'], ['Mr. Gardiner'], ['Mr. Gardiner'], ['Mr. Gardiner']]]"
"Q907","This is a most unfortunate affair; and will probably be much talked of.
But we must stem the tide of malice, and pour into the wounded bosoms of
each other, the balm of sisterly consolation.","['This is a most unfortunate affair; and will probably be much talked of.\nBut we must stem the tide of malice, and pour into the wounded bosoms of\neach other, the balm of sisterly consolation.']","[[509546, 509736]]","Mary","['Elizabeth']","Anaphoric","she was mistress enough of herself to whisper to Elizabeth","[['we']]","[[[509622, 509624]]]","[[['Elizabeth', 'Mrs. Gardiner', 'Mr. Gardiner', 'Jane', 'Mrs. Bennet', 'Mary', 'Kitty']]]"
"Q908","Unhappy as the event must be for Lydia, we may draw from it this useful
lesson; that loss of virtue in a female is irretrievable--that one false
step involves her in endless ruin--that her reputation is no less
brittle than it is beautiful,--and that she cannot be too much guarded
in her behaviour towards the undeserving of the other sex.","['Unhappy as the event must be for Lydia, we may draw from it this useful\nlesson; that loss of virtue in a female is irretrievable--that one false\nstep involves her in endless ruin--that her reputation is no less\nbrittle than it is beautiful,--and that she cannot be too much guarded\nin her behaviour towards the undeserving of the other sex.']","[[509809, 510149]]","Mary","['Elizabeth']","Anaphoric","she added","[['Lydia', 'we', 'her', 'her', 'she', 'her']]","[[[509842, 509847], [509849, 509851], [509968, 509971], [509994, 509997], [510060, 510063], [510094, 510097]]]","[[['Lydia'], ['Elizabeth', 'Mrs. Gardiner', 'Mr. Gardiner', 'Jane', 'Mrs. Bennet', 'Mary', 'Kitty'], ['Lydia'], ['Lydia'], ['Lydia'], ['Lydia']]]"
"Q909","But tell me all and every thing about it, which
I have not already heard. Give me farther particulars. What did Colonel
Forster say? Had they no apprehension of any thing before the elopement
took place? They must have seen them together for ever.","['But tell me all and every thing about it, which\nI have not already heard. Give me farther particulars. What did Colonel\nForster say? Had they no apprehension of any thing before the elopement\ntook place? They must have seen them together for ever.']","[[510797, 511044]]","Elizabeth","['Jane']","Anaphoric","the former continued the subject by saying","[['Colonel\nForster ', 'they', 'They', 'them']]","[[[510909, 510925], [510934, 510938], [511001, 511005], [511021, 511025]]]","[[['Colonel Forster'], ['Colonel Forster'], ['Colonel Forster'], ['George Wickham', 'Lydia']]]"
"Q910","Colonel Forster did own that he had often suspected some partiality,
especially on Lydia's side, but nothing to give him any alarm. I am so
grieved for him. His behaviour was attentive and kind to the utmost. He
_was_ coming to us, in order to assure us of his concern, before he had
any idea of their not being gone to Scotland: when that apprehension
first got abroad, it hastened his journey.","[""Colonel Forster did own that he had often suspected some partiality,\nespecially on Lydia's side, but nothing to give him any alarm. I am so\ngrieved for him. His behaviour was attentive and kind to the utmost. He\n_was_ coming to us, in order to assure us of his concern, before he had\nany idea of their not being gone to Scotland: when that apprehension\nfirst got abroad, it hastened his journey.""]","[[511048, 511443]]","Jane","['Elizabeth']","Implicit","nan","[['Colonel Forster', 'he', 'Lydia', 'him', 'him', 'His', 'He', 'us', 'us', 'his', 'he', 'their', 'his']]","[[[511048, 511063], [511077, 511079], [511131, 511136], [511165, 511168], [511200, 511203], [511205, 511208], [511257, 511259], [511276, 511278], [511299, 511301], [511305, 511308], [511325, 511327], [511344, 511349], [511431, 511434]]]","[[['Colonel Forster'], ['Colonel Forster'], ['Lydia'], ['Colonel Forster'], ['Colonel Forster'], ['Colonel Forster'], ['Colonel Forster'], ['Mary', 'Mrs. Bennet', 'Kitty', 'Mr. Bennet'], ['Mary', 'Mrs. Bennet', 'Kitty', 'Mr. Bennet'], ['Colonel Forster'], ['Colonel Forster'], ['George Wickham', 'Lydia'], ['Colonel Forster']]]"
"Q911","And was Denny convinced that Wickham would not marry? Did he know of
their intending to go off? Had Colonel Forster seen Denny himself?","['And was Denny convinced that Wickham would not marry? Did he know of\ntheir intending to go off? Had Colonel Forster seen Denny himself?']","[[511447, 511582]]","Elizabeth","['Jane']","Implicit","nan","[['Wickham', 'their ', 'Colonel Forster', 'himself']]","[[[511476, 511483], [511516, 511522], [511547, 511562], [511574, 511581]]]","[[['George Wickham'], ['George Wickham', 'Lydia'], ['Colonel Forster'], ['Colonel Forster']]]"
"Q912","Yes; but when questioned by _him_ Denny denied knowing any thing of
their plan, and would not give his real opinion about it. He did not
repeat his persuasion of their not marrying--and from _that_, I am
inclined to hope, he might have been misunderstood before.","['Yes; but when questioned by _him_ Denny denied knowing any thing of\ntheir plan, and would not give his real opinion about it. He did not\nrepeat his persuasion of their not marrying--and from _that_, I am\ninclined to hope, he might have been misunderstood before.']","[[511586, 511848]]","Jane","['Elizabeth']","Implicit","nan","[['him', 'their']]","[[[511615, 511618], [511748, 511753]]]","[[['Colonel Forster'], ['George Wickham', 'Lydia']]]"
"Q913","And till Colonel Forster came himself, not one of you entertained a
doubt, I suppose, of their being really married?","['And till Colonel Forster came himself, not one of you entertained a\ndoubt, I suppose, of their being really married?']","[[511852, 511968]]","Elizabeth","['Jane']","Implicit","nan","[['Colonel Forster', 'himself', 'you', 'their']]","[[[511861, 511876], [511882, 511889], [511902, 511905], [511941, 511946]]]","[[['Colonel Forster'], ['Colonel Forster'], ['Mary', 'Mrs. Bennet', 'Kitty', 'Mr. Bennet'], ['George Wickham', 'Lydia']]]"
"Q914","How was it possible that such an idea should enter our brains! I felt a
little uneasy--a little fearful of my sister's happiness with him in
marriage, because I knew that his conduct had not been always quite
right. My father and mother knew nothing of that, they only felt how
imprudent a match it must be. Kitty then owned, with a very natural
triumph on knowing more than the rest of us, that in Lydia's last
letter, she had prepared her for such a step. She had known, it seems,
of their being in love with each other, many weeks.","[""How was it possible that such an idea should enter our brains! I felt a\nlittle uneasy--a little fearful of my sister's happiness with him in\nmarriage, because I knew that his conduct had not been always quite\nright. My father and mother knew nothing of that, they only felt how\nimprudent a match it must be. Kitty then owned, with a very natural\ntriumph on knowing more than the rest of us, that in Lydia's last\nletter, she had prepared her for such a step. She had known, it seems,\nof their being in love with each other, many weeks.""]","[[511972, 512506]]","Jane","['Elizabeth']","Implicit","nan","[['our', 'my sister', 'him', 'his', 'My father and mother', 'mother ', 'they', 'Kitty', 'us', 'Lydia', 'she', 'her', 'She', 'their']]","[[[512023, 512026], [512079, 512088], [512106, 512109], [512143, 512146], [512188, 512208], [512202, 512209], [512231, 512235], [512280, 512285], [512359, 512361], [512371, 512376], [512392, 512395], [512409, 512412], [512430, 512433], [512458, 512463]]]","[[['Jane', 'Mrs. Bennet', 'Mary', 'Mr. Bennet', 'Kitty'], ['Lydia'], ['George Wickham'], ['George Wickham'], ['Mr. Bennet'], ['Mrs. Bennet'], ['Mr. Bennet', 'Mrs. Bennet'], ['Kitty'], ['Mary', 'Mrs. Bennet', 'Mr. Bennet'], ['Lydia'], ['Lydia'], ['Kitty'], ['Kitty'], ['George Wickham', 'Lydia']]]"
"Q915","But not before they went to Brighton?","['But not before they went to Brighton?']","[[512510, 512547]]","Elizabeth","['Jane']","Implicit","nan","[['they']]","[[[512525, 512529]]]","[[['George Wickham', 'Lydia']]]"
"Q916","No, I believe not.","['No, I believe not.']","[[512551, 512569]]","Jane","['Elizabeth']","Implicit","nan","[[]]","[[]]","[[]]"
"Q917","And did Colonel Forster appear to think ill of Wickham himself? Does he
know his real character?","['And did Colonel Forster appear to think ill of Wickham himself? Does he\nknow his real character?']","[[512573, 512669]]","Elizabeth","['Jane']","Implicit","nan","[['Colonel Forster', 'Wickham', 'himself', 'he', 'his']]","[[[512581, 512596], [512620, 512627], [512628, 512635], [512642, 512644], [512650, 512653]]]","[[['Colonel Forster'], ['George Wickham'], ['Colonel Forster'], ['Colonel Forster'], ['George Wickham']]]"
"Q918","I must confess that he did not speak so well of Wickham as he formerly
did. He believed him to be imprudent and extravagant. And since this sad
affair has taken place, it is said, that he left Meryton greatly in
debt; but I hope this may be false.","['I must confess that he did not speak so well of Wickham as he formerly\ndid. He believed him to be imprudent and extravagant. And since this sad\naffair has taken place, it is said, that he left Meryton greatly in\ndebt; but I hope this may be false.']","[[512673, 512920]]","Jane","['Elizabeth']","Implicit","nan","[['he', 'he', 'He']]","[[[512693, 512695], [512732, 512734], [512749, 512751]]]","[[['Colonel Forster'], ['Colonel Forster'], ['Colonel Forster']]]"
"Q919","Oh, Jane, had we been less secret, had we told what we knew of him,
this could not have happened!","['Oh, Jane, had we been less secret, had we told what we knew of him,\nthis could not have happened!']","[[512924, 513021]]","Elizabeth","['Jane']","Implicit","nan","[['Jane', 'we', 'we', 'we']]","[[[512928, 512932], [512938, 512940], [512963, 512965], [512976, 512978]]]","[[['Jane'], ['Elizabeth', 'Jane'], ['Elizabeth', 'Jane'], ['Elizabeth', 'Jane']]]"
"Q920","Perhaps it would have been better; But to expose
the former faults of any person, without knowing what their present
feelings were, seemed unjustifiable. We acted with the best intentions.","['Perhaps it would have been better;', 'But to expose\nthe former faults of any person, without knowing what their present\nfeelings were, seemed unjustifiable. We acted with the best intentions.']","[[513025, 513059], [513082, 513235]]","Jane","['Elizabeth']","Anaphoric","replied her sister","[[], ['their', 'We']]","[[], [[513150, 513155], [513201, 513203]]]","[[], [['Lydia', 'George Wickham'], ['Elizabeth', 'Jane']]]"
"Q921","Could Colonel Forster repeat the particulars of Lydia's note to his
wife?","[""Could Colonel Forster repeat the particulars of Lydia's note to his\nwife?""]","[[513239, 513312]]","Elizabeth","['Jane']","Implicit","nan","[['Colonel Forster', 'Lydia']]","[[[513245, 513260], [513287, 513292]]]","[[['Colonel Forster'], ['Lydia']]]"
"Q922","He brought it with him for us to see.","['He brought it with him for us to see.']","[[513316, 513353]]","Jane","['Elizabeth']","Implicit","nan","[['He', 'him', 'us']]","[[[513316, 513318], [513335, 513338], [513343, 513345]]]","[[['Colonel Forster'], ['Colonel Forster'], ['Mary', 'Mrs. Bennet', 'Kitty', 'Mr. Bennet']]]"
"Q923","Oh! thoughtless, thoughtless Lydia! What a letter is this, to be written at such a moment. But
at least it shews, that _she_ was serious in the object of her journey.
Whatever he might afterwards persuade her to, it was not on her side a
_scheme_ of infamy. My poor father! how he must have felt it!","['Oh! thoughtless, thoughtless Lydia!', 'What a letter is this, to be written at such a moment. But\nat least it shews, that _she_ was serious in the object of her journey.\nWhatever he might afterwards persuade her to, it was not on her side a\n_scheme_ of infamy. My poor father! how he must have felt it!']","[[514694, 514729], [514774, 515037]]","Elizabeth","['Jane']","Explicit","cried Elizabeth","[['Lydia'], ['she', 'her', 'he', 'her', 'her', 'My poor father', 'he']]","[[[514723, 514728]], [[514858, 514861], [514892, 514895], [514914, 514916], [514943, 514946], [514965, 514968], [514996, 515010], [515016, 515018]]]","[[['Lydia']], [['Lydia'], ['Lydia'], ['George Wickham'], ['Lydia'], ['Lydia'], ['Mr. Bennet'], ['Mr. Bennet']]]"
"Q924","I never saw any one so shocked. He could not speak a word for full ten
minutes. My mother was taken ill immediately, and the whole house in
such confusion!","['I never saw any one so shocked. He could not speak a word for full ten\nminutes. My mother was taken ill immediately, and the whole house in\nsuch confusion!']","[[515041, 515196]]","Jane","['Elizabeth']","Implicit","nan","[['He', 'My mother ']]","[[[515073, 515075], [515121, 515131]]]","[[['Mr. Bennet'], ['Mrs. Bennet']]]"
"Q925","Oh! Jane, was there a servant belonging to it, who
did not know the whole story before the end of the day?","['Oh! Jane,', 'was there a servant belonging to it, who\ndid not know the whole story before the end of the day?']","[[515200, 515209], [515229, 515325]]","Elizabeth","['Jane']","Explicit","cried Elizabeth","[['Jane'], []]","[[[515204, 515208]], []]","[[['Jane']], []]"
"Q926","I do not know.--I hope there was.--But to be guarded at such a time, is
very difficult. My mother was in hysterics, and though I endeavoured to
give her every assistance in my power, I am afraid I did not do so much
as I might have done! But the horror of what might possibly happen,
almost took from me my faculties.","['I do not know.--I hope there was.--But to be guarded at such a time, is\nvery difficult. My mother was in hysterics, and though I endeavoured to\ngive her every assistance in my power, I am afraid I did not do so much\nas I might have done! But the horror of what might possibly happen,\nalmost took from me my faculties.']","[[515329, 515646]]","Jane","['Elizabeth']","Implicit","nan","[['My mother', 'her']]","[[[515417, 515426], [515478, 515481]]]","[[['Mrs. Bennet'], ['Mrs. Bennet']]]"
"Q927","Your attendance upon her, has been too much for you. You do not look
well. Oh! that I had been with you, you have had every care and anxiety
upon yourself alone.","['Your attendance upon her, has been too much for you. You do not look\nwell. Oh! that I had been with you, you have had every care and anxiety\nupon yourself alone.']","[[515650, 515811]]","Elizabeth","['Jane']","Implicit","nan","[['her', 'you', 'You', 'you', 'you', 'yourself']]","[[[515671, 515674], [515698, 515701], [515703, 515706], [515750, 515753], [515755, 515758], [515796, 515804]]]","[[['Mrs. Bennet'], ['Jane'], ['Jane'], ['Jane'], ['Jane'], ['Jane']]]"
"Q928","Mary and Kitty have been very kind, and would have shared in every
fatigue, I am sure, but I did not think it right for either of them.
Kitty is slight and delicate, and Mary studies so much, that her hours
of repose should not be broken in on. My aunt Philips came to Longbourn
on Tuesday, after my father went away; and was so good as to stay till
Thursday with me. She was of great use and comfort to us all, and lady
Lucas has been very kind; she walked here on Wednesday morning to
condole with us, and offered her services, or any of her daughters, if
they could be of use to us.","['Mary and Kitty have been very kind, and would have shared in every\nfatigue, I am sure, but I did not think it right for either of them.\nKitty is slight and delicate, and Mary studies so much, that her hours\nof repose should not be broken in on. My aunt Philips came to Longbourn\non Tuesday, after my father went away; and was so good as to stay till\nThursday with me. She was of great use and comfort to us all, and lady\nLucas has been very kind; she walked here on Wednesday morning to\ncondole with us, and offered her services, or any of her daughters, if\nthey could be of use to us.']","[[515815, 516400]]","Jane","['Elizabeth']","Implicit","nan","[['Mary', 'Kitty', 'them', 'Kitty ', 'Mary', 'her', 'my father', 'us', 'lady\nLucas', 'she', 'us', 'her', 'her', 'daughters', 'they ', 'us']]","[[[515815, 515819], [515824, 515829], [515945, 515949], [515951, 515957], [515985, 515989], [516012, 516015], [516112, 516121], [516219, 516221], [516231, 516241], [516262, 516265], [516315, 516317], [516331, 516334], [516355, 516358], [516359, 516368], [516373, 516378], [516397, 516399]]]","[[['Mary'], ['Kitty'], ['Mary', 'Kitty'], ['Kitty'], ['Mary'], ['Mary'], ['Mr. Bennet'], ['Mary', 'Mrs. Bennet', 'Kitty'], ['Lady Lucas'], ['Lady Lucas'], ['Mary', 'Mrs. Bennet', 'Kitty'], ['Lady Lucas'], ['Lady Lucas'], ['Charlotte Lucas'], ['Charlotte Lucas'], ['Mary', 'Mrs. Bennet', 'Kitty']]]"
"Q929","She had better have stayed at home, perhaps she
_meant_ well, but, under such a misfortune as this, one cannot see too
little of one's neighbours. Assistance is impossible; condolence,
insufferable. Let them triumph over us at a distance, and be satisfied.","['She had better have stayed at home,', ""perhaps she\n_meant_ well, but, under such a misfortune as this, one cannot see too\nlittle of one's neighbours. Assistance is impossible; condolence,\ninsufferable. Let them triumph over us at a distance, and be satisfied.""]","[[516404, 516439], [516459, 516679]]","Elizabeth","['Jane']","Explicit","cried Elizabeth","[['She'], ['she', 'us']]","[[[516404, 516407]], [[516467, 516470], [516644, 516646]]]","[[['Lady Lucas']], [['Lady Lucas'], ['Mary', 'Mrs. Bennet', 'Kitty', 'Mr. Bennet']]]"
"Q930","He meant, I believe, to go to Epsom, the place where
they last changed horses, see the postilions, and try if any thing could
be made out from them. His principal object must be, to discover the
number of the hackney coach which took them from Clapham. It had come
with a fare from London; and as he thought the circumstance of a
gentleman and lady's removing from one carriage into another, might be
remarked, he meant to make enquiries at Clapham. If he could any how
discover at what house the coachman had before set down his fare, he
determined to make enquiries there, and hoped it might not be impossible
to find out the stand and number of the coach. I do not know of any
other designs that he had formed: but he was in such a hurry to be gone,
and his spirits so greatly discomposed, that I had difficulty in finding
out even so much as this.","['He meant, I believe,', ""to go to Epsom, the place where\nthey last changed horses, see the postilions, and try if any thing could\nbe made out from them. His principal object must be, to discover the\nnumber of the hackney coach which took them from Clapham. It had come\nwith a fare from London; and as he thought the circumstance of a\ngentleman and lady's removing from one carriage into another, might be\nremarked, he meant to make enquiries at Clapham. If he could any how\ndiscover at what house the coachman had before set down his fare, he\ndetermined to make enquiries there, and hoped it might not be impossible\nto find out the stand and number of the coach. I do not know of any\nother designs that he had formed: but he was in such a hurry to be gone,\nand his spirits so greatly discomposed, that I had difficulty in finding\nout even so much as this.""]","[[516822, 516842], [516859, 517689]]","Jane","['Elizabeth']","Explicit","replied Jane","[['He'], ['them', 'His', 'them', 'he', 'he', 'he', 'his', 'he', 'he', 'he', 'his']]","[[[516822, 516824]], [[516981, 516985], [516987, 516990], [517072, 517076], [517135, 517137], [517249, 517251], [517291, 517293], [517364, 517367], [517374, 517376], [517537, 517539], [517556, 517558], [517595, 517598]]]","[[['Mr. Bennet']], [['George Wickham', 'Lydia'], ['Mr. Bennet'], ['George Wickham', 'Lydia'], ['Mr. Bennet'], ['Mr. Bennet'], ['Mr. Bennet'], ['Mr. Bennet'], ['Mr. Bennet'], ['Mr. Bennet'], ['Mr. Bennet'], ['Mr. Bennet']]]"
"Q931","A gamester! This is
wholly unexpected. I had not an idea of it.","['A gamester!', 'This is\nwholly unexpected. I had not an idea of it.']","[[526004, 526015], [526029, 526080]]","Jane","[]","Anaphoric","she cried","[[], []]","[[], []]","[[], []]"
"Q932","What, is he coming home, and without poor Lydia! Sure he
will not leave London before he has found them. Who is to fight Wickham,
and make him marry her, if he comes away?","['What, is he coming home, and without poor Lydia!', 'Sure he\nwill not leave London before he has found them. Who is to fight Wickham,\nand make him marry her, if he comes away?']","[[526626, 526674], [526688, 526810]]","Mrs. Bennet","[]","Anaphoric","she cried","[['he', 'Lydia'], ['he', 'he', 'them', 'Wickham', 'him', 'her', 'he']]","[[[526635, 526637], [526668, 526673]], [[526693, 526695], [526725, 526727], [526738, 526742], [526760, 526767], [526778, 526781], [526788, 526791], [526796, 526798]]]","[[['Mr. Bennet'], ['Lydia']], [['Mr. Bennet'], ['Mr. Bennet'], ['George Wickham', 'Lydia'], ['George Wickham'], ['George Wickham'], ['Lydia'], ['Mr. Bennet']]]"
"Q933","Say
nothing of that. Who should suffer but myself? It has been my own doing,
and I ought to feel it.","['Say\nnothing of that. Who should suffer but myself? It has been my own doing,\nand I ought to feel it.']","[[528435, 528535]]","Mr. Bennet","['Elizabeth', 'Kitty']","Anaphoric","he replied","[[]]","[[]]","[[]]"
"Q934","You must not be too severe upon yourself,","['You must not be too severe upon yourself,']","[[528539, 528580]]","Elizabeth","['Mr. Bennet', 'Kitty']","Explicit","replied Elizabeth","[['You', 'yourself']]","[[[528539, 528542], [528571, 528579]]]","[[['Mr. Bennet'], ['Mr. Bennet']]]"
"Q935","You may well warn me against such an evil. Human nature is so prone to
fall into it! No, Lizzy, let me once in my life feel how much I have
been to blame. I am not afraid of being overpowered by the impression.
It will pass away soon enough.","['You may well warn me against such an evil. Human nature is so prone to\nfall into it! No, Lizzy, let me once in my life feel how much I have\nbeen to blame. I am not afraid of being overpowered by the impression.\nIt will pass away soon enough.']","[[528603, 528844]]","Mr. Bennet","['Elizabeth', 'Kitty']","Implicit","nan","[['You', 'Lizzy']]","[[[528603, 528606], [528692, 528697]]]","[[['Elizabeth'], ['Elizabeth']]]"
"Q936","Do you suppose them to be in London?","['Do you suppose them to be in London?']","[[528848, 528884]]","Elizabeth","['Mr. Bennet', 'Kitty']","Implicit","nan","[['you', 'them']]","[[[528851, 528854], [528863, 528867]]]","[[['Mr. Bennet'], ['George Wickham', 'Lydia']]]"
"Q937","Yes; where else can they be so well concealed?","['Yes; where else can they be so well concealed?']","[[528888, 528934]]","Mr. Bennet","['Elizabeth', 'Kitty']","Implicit","nan","[['they']]","[[[528908, 528912]]]","[[['George Wickham', 'Lydia']]]"
"Q938","And Lydia used to want to go to London,","['And Lydia used to want to go to London,']","[[528938, 528977]]","Kitty","['Elizabeth', 'Mr. Bennet']","Explicit","added Kitty","[['Lydia']]","[[[528942, 528947]]]","[[['Lydia']]]"
