"quoteID","quoteText","subQuotationList","quoteByteSpans","speaker","addressees","quoteType","referringExpression","mentionTextsList","mentionSpansList","mentionEntitiesList"
"Q0","My dear Mr. Bennet, have you heard that
Netherfield Park is let at last?","['My dear Mr. Bennet,', 'have you heard that\nNetherfield Park is let at last?']","[[395, 414], [447, 499]]","Mrs. Bennet","['Mr. Bennet']","Anaphoric","said his lady to him","[['My dear Mr. Bennet', 'Mr. Bennet'], ['you']]","[[[395, 413], [403, 413]], [[452, 455]]]","[[['Mr. Bennet'], ['Mr. Bennet']], [['Mr. Bennet']]]"
"Q1","But it is, for Mrs. Long has just been here, and she
told me all about it.","['But it is,', 'for Mrs. Long has just been here, and she\ntold me all about it.']","[[540, 550], [567, 630]]","Mrs. Bennet","['Mr. Bennet']","Anaphoric","returned she","[[], ['Mrs. Long', 'she']]","[[], [[571, 580], [605, 608]]]","[[], [['Mrs. Long'], ['Mrs. Long']]]"
"Q2","Do not you want to know who has taken it?","['Do not you want to know who has taken it?']","[[662, 703]]","Mrs. Bennet","['Mr. Bennet']","Anaphoric","cried his wife","[['you']]","[[[669, 672]]]","[[['Mr. Bennet']]]"
"Q3","_You_ want to tell me, and I have no objection to hearing it.","['_You_ want to tell me, and I have no objection to hearing it.']","[[735, 796]]","Mr. Bennet","['Mrs. Bennet']","Implicit","nan","[['You']]","[[[736, 739]]]","[[['Mrs. Bennet']]]"
"Q4","Why, my dear, you must know, Mrs. Long says that Netherfield is taken
by a young man of large fortune from the north of England; that he came
down on Monday in a chaise and four to see the place, and was so much
delighted with it that he agreed with Mr. Morris immediately; that he is
to take possession before Michaelmas, and some of his servants are to be
in the house by the end of next week.","['Why, my dear, you must know, Mrs. Long says that Netherfield is taken\nby a young man of large fortune from the north of England; that he came\ndown on Monday in a chaise and four to see the place, and was so much\ndelighted with it that he agreed with Mr. Morris immediately; that he is\nto take possession before Michaelmas, and some of his servants are to be\nin the house by the end of next week.']","[[829, 1224]]","Mrs. Bennet","['Mr. Bennet']","Implicit","nan","[['my dear', 'you', 'Mrs. Long', 'a young man', 'he', 'he', 'Mr. Morris', 'he', 'his']]","[[[834, 841], [843, 846], [858, 867], [902, 913], [963, 965], [1064, 1066], [1079, 1089], [1108, 1110], [1164, 1167]]]","[[['Mr. Bennet'], ['Mr. Bennet'], ['Mrs. Long'], ['Bingley'], ['Mr. Bingley'], ['Mr. Bingley'], ['Mr. Morris'], ['Mr. Bingley'], ['Mr. Bingley']]]"
"Q5","What is his name?","['What is his name?']","[[1228, 1245]]","Mr. Bennet","['Mrs. Bennet']","Implicit","nan","[['his']]","[[[1236, 1239]]]","[[['Mr. Bingley']]]"
"Q6","Bingley.","['Bingley.']","[[1249, 1257]]","Mrs. Bennet","['Mr. Bennet']","Implicit","nan","[['Bingley']]","[[[1249, 1256]]]","[[['Mr. Bingley']]]"
"Q7","Is he married or single?","['Is he married or single?']","[[1261, 1285]]","Mr. Bennet","['Mrs. Bennet']","Implicit","nan","[['he']]","[[[1264, 1266]]]","[[['Mr. Bingley']]]"
"Q8","Oh! single, my dear, to be sure! A single man of large fortune; four
or five thousand a year. What a fine thing for our girls!","['Oh! single, my dear, to be sure! A single man of large fortune; four\nor five thousand a year. What a fine thing for our girls!']","[[1289, 1415]]","Mrs. Bennet","['Mr. Bennet']","Implicit","nan","[['my dear', 'our girls']]","[[[1301, 1308], [1405, 1414]]]","[[['Mr. Bennet'], ['Mary', 'Elizabeth', 'Lydia', 'Kitty', 'Jane']]]"
"Q9","How so? how can it affect them?","['How so? how can it affect them?']","[[1419, 1450]]","Mr. Bennet","['Mrs. Bennet']","Implicit","nan","[['them']]","[[[1445, 1449]]]","[[['Mary', 'Elizabeth', 'Lydia', 'Kitty', 'Jane']]]"
"Q10","My dear Mr. Bennet, how can you be so tiresome! You
must know that I am thinking of his marrying one of them.","['My dear Mr. Bennet,', 'how can you be so tiresome! You\nmust know that I am thinking of his marrying one of them.']","[[1454, 1473], [1494, 1583]]","Mrs. Bennet","['Mr. Bennet']","Anaphoric","replied his wife","[['Mr. Bennet'], ['you', 'his', 'them']]","[[[1462, 1472]], [[1502, 1505], [1558, 1561], [1578, 1582]]]","[[['Mr. Bennet']], [['Mr. Bennet'], ['Mr. Bingley'], ['Mary', 'Elizabeth', 'Lydia', 'Kitty', 'Jane']]]"
"Q11","Is that his design in settling here?","['Is that his design in settling here?']","[[1587, 1623]]","Mr. Bennet","['Mrs. Bennet']","Implicit","nan","[['his']]","[[[1595, 1598]]]","[[['Mr. Bingley']]]"
"Q12","Design! nonsense, how can you talk so! But it is very likely that he
_may_ fall in love with one of them, and therefore you must visit him as
soon as he comes.","['Design! nonsense, how can you talk so! But it is very likely that he\n_may_ fall in love with one of them, and therefore you must visit him as\nsoon as he comes.']","[[1627, 1786]]","Mrs. Bennet","['Mr. Bennet']","Implicit","nan","[['you', 'he', 'them', 'you', 'him', 'he']]","[[[1653, 1656], [1693, 1695], [1727, 1731], [1747, 1750], [1762, 1765], [1777, 1779]]]","[[['Mr. Bennet'], ['Mr. Bingley'], ['Mary', 'Elizabeth', 'Lydia', 'Kitty', 'Jane'], ['Mr. Bennet'], ['Mr. Bingley'], ['Mr. Bingley']]]"
"Q13","I see no occasion for that. You and the girls may go, or you may send
them by themselves, which perhaps will be still better, for as you are
as handsome as any of them, Mr. Bingley might like you the best of the
party.","['I see no occasion for that. You and the girls may go, or you may send\nthem by themselves, which perhaps will be still better, for as you are\nas handsome as any of them, Mr. Bingley might like you the best of the\nparty.']","[[1790, 2008]]","Mr. Bennet","['Mrs. Bennet']","Implicit","nan","[['You', 'the girls', 'you', 'you', 'them', 'you', 'the\nparty']]","[[[1818, 1821], [1826, 1835], [1847, 1850], [1923, 1926], [1953, 1957], [1982, 1985], [1998, 2007]]]","[[['Mrs. Bennet'], ['Mary', 'Elizabeth', 'Lydia', 'Kitty', 'Jane'], ['Mrs. Bennet'], ['Mrs. Bennet'], ['Mary', 'Elizabeth', 'Lydia', 'Kitty', 'Jane'], ['Mrs. Bennet'], ['Elizabeth', 'Mrs. Bennet', 'Jane', 'Lydia', 'Mary', 'Kitty']]]"
"Q14","My dear, you flatter me. I certainly _have_ had my share of beauty, but
I do not pretend to be any thing extraordinary now. When a woman has
five grown up daughters, she ought to give over thinking of her own
beauty.","['My dear, you flatter me. I certainly _have_ had my share of beauty, but\nI do not pretend to be any thing extraordinary now. When a woman has\nfive grown up daughters, she ought to give over thinking of her own\nbeauty.']","[[2012, 2228]]","Mrs. Bennet","['Mr. Bennet']","Implicit","nan","[['My dear', 'you']]","[[[2012, 2019], [2021, 2024]]]","[[['Mr. Bennet'], ['Mr. Bennet']]]"
"Q15","In such cases, a woman has not often much beauty to think of.","['In such cases, a woman has not often much beauty to think of.']","[[2232, 2293]]","Mr. Bennet","['Mrs. Bennet']","Implicit","nan","[[]]","[[]]","[[]]"
"Q16","But, my dear, you must indeed go and see Mr. Bingley when he comes into
the neighbourhood.","['But, my dear, you must indeed go and see Mr. Bingley when he comes into\nthe neighbourhood.']","[[2297, 2387]]","Mrs. Bennet","['Mr. Bennet']","Implicit","nan","[['my dear', 'you', 'Mr. Bingley', 'he']]","[[[2302, 2309], [2311, 2314], [2338, 2349], [2355, 2357]]]","[[['Mr. Bennet'], ['Mr. Bennet'], ['Mr. Bingley'], ['Mr. Bingley']]]"
"Q17","It is more than I engage for, I assure you.","['It is more than I engage for, I assure you.']","[[2391, 2434]]","Mr. Bennet","['Mrs. Bennet']","Implicit","nan","[['you']]","[[[2430, 2433]]]","[[['Mrs. Bennet']]]"
"Q18","But consider your daughters. Only think what an establishment it would
be for one of them. Sir William and Lady Lucas are determined to go,
merely on that account, for in general you know they visit no new
comers. Indeed you must go, for it will be impossible for _us_ to visit
him, if you do not.","['But consider your daughters. Only think what an establishment it would\nbe for one of them. Sir William and Lady Lucas are determined to go,\nmerely on that account, for in general you know they visit no new\ncomers. Indeed you must go, for it will be impossible for _us_ to visit\nhim, if you do not.']","[[2438, 2735]]","Mrs. Bennet","['Mr. Bennet']","Implicit","nan","[['your daughters', 'them', 'Sir William', 'Lady Lucas', 'you', 'they', 'you', 'us', 'you']]","[[[2451, 2465], [2523, 2527], [2529, 2540], [2545, 2555], [2617, 2620], [2626, 2630], [2659, 2662], [2703, 2705], [2724, 2727]]]","[[['Mary', 'Elizabeth', 'Lydia', 'Kitty', 'Jane'], ['Mary', 'Elizabeth', 'Lydia', 'Kitty', 'Jane'], ['Sir William Lucas'], ['Lady Lucas'], ['Mr. Bennet'], ['Sir William Lucas', 'Lady Lucas'], ['Mr. Bennet'], ['Mary', 'Elizabeth', 'Lydia', 'Mrs. Bennet', 'Kitty', 'Jane'], ['Mr. Bennet']]]"
"Q19","You are over scrupulous surely. I dare say Mr. Bingley will be very
glad to see you; and I will send a few lines by you to assure him of my
hearty consent to his marrying which ever he chuses of the girls; though
I must throw in a good word for my little Lizzy.","['You are over scrupulous surely. I dare say Mr. Bingley will be very\nglad to see you; and I will send a few lines by you to assure him of my\nhearty consent to his marrying which ever he chuses of the girls; though\nI must throw in a good word for my little Lizzy.']","[[2739, 3000]]","Mr. Bennet","['Mrs. Bennet']","Implicit","nan","[['You', 'Mr. Bingley', 'you', 'you', 'him', 'his', 'he', 'the girls', 'my little Lizzy']]","[[[2739, 2742], [2782, 2793], [2819, 2822], [2855, 2858], [2869, 2872], [2897, 2900], [2921, 2923], [2934, 2943], [2984, 2999]]]","[[['Mrs. Bennet'], ['Mr. Bingley'], ['Mary', 'Elizabeth', 'Lydia', 'Mrs. Bennet', 'Kitty', 'Jane'], ['Mary', 'Elizabeth', 'Lydia', 'Mrs. Bennet', 'Kitty', 'Jane'], ['Mr. Bingley'], ['Mr. Bingley'], ['Mr. Bingley'], ['Mary', 'Elizabeth', 'Lydia', 'Kitty', 'Jane'], ['Elizabeth']]]"
"Q20","I desire you will do no such thing. Lizzy is not a bit better than the
others; and I am sure she is not half so handsome as Jane, nor half so
good humoured as Lydia. But you are always giving _her_ the
preference.","['I desire you will do no such thing. Lizzy is not a bit better than the\nothers; and I am sure she is not half so handsome as Jane, nor half so\ngood humoured as Lydia. But you are always giving _her_ the\npreference.']","[[3004, 3217]]","Mrs. Bennet","['Mr. Bennet']","Implicit","nan","[['you', 'Lizzy', 'the\nothers', 'she', 'Jane', 'Lydia', 'you', 'her']]","[[[3013, 3016], [3040, 3045], [3071, 3081], [3097, 3100], [3128, 3132], [3163, 3168], [3174, 3177], [3197, 3200]]]","[[['Mr. Bennet'], ['Elizabeth'], ['Jane', 'Lydia', 'Mary', 'Kitty'], ['Elizabeth'], ['Jane'], ['Lydia'], ['Mr. Bennet'], ['Elizabeth']]]"
"Q21","They have none of them much to recommend them, they are
all silly and ignorant like other girls; but Lizzy has something more of
quickness than her sisters.","['They have none of them much to recommend them,', 'they are\nall silly and ignorant like other girls; but Lizzy has something more of\nquickness than her sisters.']","[[3221, 3267], [3282, 3391]]","Mr. Bennet","['Mrs. Bennet']","Anaphoric","replied he","[['They', 'them', 'them'], ['they', 'Lizzy', 'her sisters']]","[[[3221, 3225], [3239, 3243], [3262, 3266]], [[3282, 3286], [3336, 3341], [3379, 3390]]]","[[['Mary', 'Lydia', 'Kitty', 'Jane'], ['Mary', 'Lydia', 'Kitty', 'Jane'], ['Mary', 'Lydia', 'Kitty', 'Jane']], [['Mary', 'Lydia', 'Kitty', 'Jane'], ['Elizabeth'], ['Mary', 'Lydia', 'Kitty', 'Jane']]]"
"Q22","Mr. Bennet, how can you abuse your own children in such a way? You take
delight in vexing me. You have no compassion on my poor nerves.","['Mr. Bennet, how can you abuse your own children in such a way? You take\ndelight in vexing me. You have no compassion on my poor nerves.']","[[3395, 3530]]","Mrs. Bennet","['Mr. Bennet']","Implicit","nan","[['Mr. Bennet', 'you', 'your own children', 'You', 'You']]","[[[3395, 3405], [3415, 3418], [3425, 3442], [3458, 3461], [3489, 3492]]]","[[['Mr. Bennet'], ['Mr. Bennet'], ['Mary', 'Lydia', 'Kitty', 'Jane'], ['Mr. Bennet'], ['Mr. Bennet']]]"
"Q23","You mistake me, my dear. I have a high respect for your nerves. They
are my old friends. I have heard you mention them with consideration
these twenty years at least.","['You mistake me, my dear. I have a high respect for your nerves. They\nare my old friends. I have heard you mention them with consideration\nthese twenty years at least.']","[[3534, 3700]]","Mr. Bennet","['Mrs. Bennet']","Implicit","nan","[['You', 'my dear', 'your', 'you']]","[[[3534, 3537], [3550, 3557], [3585, 3589], [3636, 3639]]]","[[['Mrs. Bennet'], ['Mrs. Bennet'], ['Mrs. Bennet'], ['Mrs. Bennet']]]"
"Q24","Ah! you do not know what I suffer.","['Ah! you do not know what I suffer.']","[[3704, 3738]]","Mrs. Bennet","['Mr. Bennet']","Implicit","nan","[['you']]","[[[3708, 3711]]]","[[['Mr. Bennet']]]"
"Q25","But I hope you will get over it, and live to see many young men of four
thousand a year come into the neighbourhood.","['But I hope you will get over it, and live to see many young men of four\nthousand a year come into the neighbourhood.']","[[3742, 3858]]","Mr. Bennet","['Mrs. Bennet']","Implicit","nan","[['you']]","[[[3753, 3756]]]","[[['Mrs. Bennet']]]"
"Q26","It will be no use to us, if twenty such should come since you will not
visit them.","['It will be no use to us, if twenty such should come since you will not\nvisit them.']","[[3862, 3944]]","Mrs. Bennet","['Mr. Bennet']","Implicit","nan","[['us', 'you']]","[[[3883, 3885], [3920, 3923]]]","[[['Mr. Bennet', 'Mrs. Bennet'], ['Mr. Bennet']]]"
"Q27","Depend upon it, my dear, that when there are twenty, I will visit them
all.","['Depend upon it, my dear, that when there are twenty, I will visit them\nall.']","[[3948, 4023]]","Mr. Bennet","['Mrs. Bennet']","Implicit","nan","[['my dear']]","[[[3964, 3971]]]","[[['Mrs. Bennet']]]"
"Q28","I hope Mr. Bingley will like it Lizzy.","['I hope Mr. Bingley will like it Lizzy.']","[[4903, 4941]]","Mr. Bennet","['Mary', 'Elizabeth', 'Lydia', 'Mrs. Bennet', 'Kitty']","Anaphoric","he suddenly addressed her","[['Mr. Bingley', 'Lizzy']]","[[[4910, 4921], [4935, 4940]]]","[[['Mr. Bingley'], ['Elizabeth']]]"
"Q29","We are not in a way to know _what_ Mr. Bingley likes, since we are not to visit.","['We are not in a way to know _what_ Mr. Bingley likes,', 'since we are not to visit.']","[[4945, 4998], [5030, 5056]]","Mrs. Bennet","['Mary', 'Elizabeth', 'Lydia', 'Kitty', 'Mr. Bennet']","Anaphoric","said her mother","[['We', 'Mr. Bingley'], ['we']]","[[[4945, 4947], [4980, 4991]], [[5036, 5038]]]","[[['Mary', 'Elizabeth', 'Lydia', 'Mrs. Bennet', 'Kitty', 'Jane', 'Mr. Bennet'], ['Mr. Bingley']], [['Mary', 'Elizabeth', 'Lydia', 'Mrs. Bennet', 'Kitty', 'Jane', 'Mr. Bennet']]]"
"Q30","But you forget, mama, that we shall meet him at the
assemblies, and that Mrs. Long has promised to introduce him.","['But you forget, mama,', 'that we shall meet him at the\nassemblies, and that Mrs. Long has promised to introduce him.']","[[5060, 5081], [5100, 5191]]","Elizabeth","['Mary', 'Mrs. Bennet', 'Lydia', 'Kitty', 'Mr. Bennet']","Explicit","said Elizabeth","[['you', 'mama'], ['we', 'him', 'Mrs. Long', 'him']]","[[[5064, 5067], [5076, 5080]], [[5105, 5107], [5119, 5122], [5151, 5160], [5187, 5190]]]","[[['Mrs. Bennet'], ['Mrs. Bennet']], [['Mary', 'Elizabeth', 'Lydia', 'Mrs. Bennet', 'Kitty', 'Jane', 'Mr. Bennet'], ['Mr. Bingley'], ['Mrs. Long'], ['Mr. Bingley']]]"
"Q31","I do not believe Mrs. Long will do any such thing. She has two nieces
of her own. She is a selfish, hypocritical woman, and I have no opinion
of her.","['I do not believe Mrs. Long will do any such thing. She has two nieces\nof her own. She is a selfish, hypocritical woman, and I have no opinion\nof her.']","[[5195, 5344]]","Mrs. Bennet","['Mary', 'Elizabeth', 'Lydia', 'Kitty', 'Mr. Bennet']","Implicit","nan","[['Mrs. Long', 'She', 'her', 'She', 'her']]","[[[5212, 5221], [5246, 5249], [5268, 5271], [5277, 5280], [5340, 5343]]]","[[['Mrs. Long'], ['Mrs. Long'], ['Mrs. Long'], ['Mrs. Long'], ['Mrs. Long']]]"
"Q32","No more have I, and I am glad to find that you do
not depend on her serving you.","['No more have I,', 'and I am glad to find that you do\nnot depend on her serving you.']","[[5348, 5363], [5383, 5447]]","Mr. Bennet","['Mary', 'Elizabeth', 'Lydia', 'Mrs. Bennet', 'Kitty']","Explicit","said Mr Bennet","[[], ['you', 'her', 'you']]","[[], [[5410, 5413], [5431, 5434], [5443, 5446]]]","[[], [['Mrs. Bennet'], ['Mrs. Long'], ['Mrs. Bennet']]]"
"Q33","Don't keep coughing so, Kitty, for heaven's sake! Have a little
compassion on my nerves. You tear them to pieces.","[""Don't keep coughing so, Kitty, for heaven's sake! Have a little\ncompassion on my nerves. You tear them to pieces.""]","[[5563, 5676]]","Mrs. Bennet","['Mary', 'Elizabeth', 'Lydia', 'Kitty', 'Mr. Bennet']","Explicit","Mrs Bennet deigned not to make any reply but unable to contain herself began scolding one of her daughters","[['Kitty', 'You']]","[[[5587, 5592], [5652, 5655]]]","[[['Kitty'], ['Kitty']]]"
"Q34","Kitty has no discretion in her coughs, she times
them ill.","['Kitty has no discretion in her coughs,', 'she times\nthem ill.']","[[5680, 5718], [5738, 5757]]","Mr. Bennet","['Mary', 'Elizabeth', 'Lydia', 'Mrs. Bennet', 'Kitty']","Anaphoric","said her father","[['Kitty', 'her'], ['she']]","[[[5680, 5685], [5707, 5710]], [[5738, 5741]]]","[[['Kitty'], ['Kitty']], [['Kitty']]]"
"Q35","I do not cough for my own amusement,","['I do not cough for my own amusement,']","[[5761, 5797]]","Kitty","['Mary', 'Elizabeth', 'Lydia', 'Mrs. Bennet', 'Mr. Bennet']","Explicit","replied Kitty","[[]]","[[]]","[[]]"
"Q36","To-morrow fortnight.","['To-morrow fortnight.']","[[5866, 5886]]","Elizabeth","['Mary', 'Mrs. Bennet', 'Lydia', 'Kitty', 'Mr. Bennet']","Implicit","nan","[[]]","[[]]","[[]]"
"Q37","Aye, so it is, and Mrs. Long does not come back
till the day before; so, it will be impossible for her to introduce him,
for she will not know him herself.","['Aye, so it is,', 'and Mrs. Long does not come back\ntill the day before; so, it will be impossible for her to introduce him,\nfor she will not know him herself.']","[[5890, 5904], [5925, 6065]]","Mrs. Bennet","['Mary', 'Elizabeth', 'Lydia', 'Kitty', 'Mr. Bennet']","Anaphoric","cried her mother","[[], ['Mrs. Long', 'her', 'him', 'she', 'him']]","[[], [[5929, 5938], [6009, 6012], [6026, 6029], [6035, 6038], [6053, 6056]]]","[[], [['Mrs. Long'], ['Mrs. Long'], ['Mr. Bingley'], ['Mrs. Long'], ['Mr. Bingley']]]"
"Q38","Then, my dear, you may have the advantage of your friend, and introduce
Mr. Bingley to _her_.","['Then, my dear, you may have the advantage of your friend, and introduce\nMr. Bingley to _her_.']","[[6069, 6162]]","Mr. Bennet","['Mary', 'Elizabeth', 'Lydia', 'Mrs. Bennet', 'Kitty']","Implicit","nan","[['my dear', 'you', 'your friend', 'Mr. Bingley', 'her']]","[[[6075, 6082], [6084, 6087], [6114, 6125], [6141, 6152], [6157, 6160]]]","[[['Mrs. Bennet'], ['Mrs. Bennet'], ['Mrs. Long'], ['Mr. Bingley'], ['Mrs. Long']]]"
"Q39","Impossible, Mr. Bennet, impossible, when I am not acquainted with him
myself; how can you be so teazing?","['Impossible, Mr. Bennet, impossible, when I am not acquainted with him\nmyself; how can you be so teazing?']","[[6166, 6270]]","Mrs. Bennet","['Mary', 'Elizabeth', 'Lydia', 'Kitty', 'Mr. Bennet']","Implicit","nan","[['Mr. Bennet', 'him', 'you']]","[[[6178, 6188], [6232, 6235], [6252, 6255]]]","[[['Mr. Bennet'], ['Mr. Bingley'], ['Mr. Bennet']]]"
"Q40","I honour your circumspection. A fortnight's acquaintance is certainly
very little. One cannot know what a man really is by the end of a
fortnight. But if _we_ do not venture, somebody else will; and after
all, Mrs. Long and her nieces must stand their chance; and therefore, as
she will think it an act of kindness, if you decline the office, I will
take it on myself.","[""I honour your circumspection. A fortnight's acquaintance is certainly\nvery little. One cannot know what a man really is by the end of a\nfortnight. But if _we_ do not venture, somebody else will; and after\nall, Mrs. Long and her nieces must stand their chance; and therefore, as\nshe will think it an act of kindness, if you decline the office, I will\ntake it on myself.""]","[[6274, 6642]]","Mr. Bennet","['Mary', 'Elizabeth', 'Lydia', 'Mrs. Bennet', 'Kitty']","Implicit","nan","[['we', 'Mrs. Long', 'her', 'their', 'she', 'you']]","[[[6429, 6431], [6484, 6493], [6498, 6501], [6520, 6525], [6552, 6555], [6593, 6596]]]","[[['Mary', 'Elizabeth', 'Lydia', 'Mrs. Bennet', 'Kitty', 'Jane', 'Mr. Bennet'], ['Mrs. Long'], ['Mrs. Long'], ['Mrs. Long'], ['Mrs. Long'], ['Mrs. Bennet']]]"
"Q41","Nonsense,
nonsense!","['Nonsense,\nnonsense!']","[[6703, 6722]]","Mrs. Bennet","['Mary', 'Elizabeth', 'Lydia', 'Kitty', 'Mr. Bennet']","Explicit","Mrs Bennet said","[[]]","[[]]","[[]]"
"Q42","What can be the meaning of that emphatic exclamation? Do
you consider the forms of introduction, and the stress that is laid on
them, as nonsense? I cannot quite agree with you _there_. What say you,
Mary? for you are a young lady of deep reflection I know, and read great
books, and make extracts.","['What can be the meaning of that emphatic exclamation?', 'Do\nyou consider the forms of introduction, and the stress that is laid on\nthem, as nonsense? I cannot quite agree with you _there_. What say you,\nMary? for you are a young lady of deep reflection I know, and read great\nbooks, and make extracts.']","[[6726, 6779], [6792, 7036]]","Mr. Bennet","['Mary', 'Elizabeth', 'Lydia', 'Mrs. Bennet', 'Kitty']","Anaphoric","cried he","[[], ['you', 'you', 'Mary', 'you']]","[[], [[6911, 6914], [6933, 6936], [6938, 6942], [6948, 6951]]]","[[], [['Mrs. Bennet'], ['Mary'], ['Mary'], ['Mary']]]"
"Q43","While Mary is adjusting her ideas, let us return to Mr.
Bingley.","['While Mary is adjusting her ideas,', 'let us return to Mr.\nBingley.']","[[7103, 7137], [7154, 7183]]","Mr. Bennet","['Mary', 'Elizabeth', 'Lydia', 'Mrs. Bennet', 'Kitty']","Anaphoric","he continued","[['Mary', 'her'], ['us', 'Mr.\nBingley']]","[[[7109, 7113], [7127, 7130]], [[7158, 7160], [7171, 7182]]]","[[['Mary'], ['Mary']], [['Mr. Bennet', 'Mrs. Bennet'], ['Mr. Bingley']]]"
"Q44","I am sick of Mr. Bingley,","['I am sick of Mr. Bingley,']","[[7187, 7212]]","Mrs. Bennet","['Mary', 'Elizabeth', 'Lydia', 'Kitty', 'Mr. Bennet']","Anaphoric","cried his wife","[['Mr. Bingley']]","[[[7200, 7211]]]","[[['Mr. Bingley']]]"
"Q45","I am sorry to hear _that_; but why did not you tell me so before? If I
had known as much this morning, I certainly would not have called on
him. It is very unlucky; but as I have actually paid the visit, we
cannot escape the acquaintance now.","['I am sorry to hear _that_; but why did not you tell me so before? If I\nhad known as much this morning, I certainly would not have called on\nhim. It is very unlucky; but as I have actually paid the visit, we\ncannot escape the acquaintance now.']","[[7232, 7474]]","Mr. Bennet","['Mary', 'Elizabeth', 'Lydia', 'Mrs. Bennet']","Implicit","nan","[['you', 'him']]","[[[7275, 7278], [7372, 7375]]]","[[['Mrs. Bennet'], ['Mr. Bingley']]]"
"Q46","How good it was in you, my dear Mr. Bennet! But I knew I should
persuade you at last. I was sure you loved your girls too well to
neglect such an acquaintance. Well, how pleased I am! and it is such a
good joke, too, that you should have gone this morning, and never said
a word about it till now.","['How good it was in you, my dear Mr. Bennet! But I knew I should\npersuade you at last. I was sure you loved your girls too well to\nneglect such an acquaintance. Well, how pleased I am! and it is such a\ngood joke, too, that you should have gone this morning, and never said\na word about it till now.']","[[7700, 7997]]","Mrs. Bennet","['Mary', 'Elizabeth', 'Lydia', 'Mr. Bennet']","Implicit","nan","[['you', 'my dear Mr. Bennet', 'you', 'you', 'your girls', 'you']]","[[[7719, 7722], [7724, 7742], [7773, 7776], [7797, 7800], [7807, 7817], [7922, 7925]]]","[[['Mr. Bennet'], ['Mr. Bennet'], ['Mr. Bennet'], ['Mr. Bennet'], ['Mary', 'Elizabeth', 'Lydia', 'Kitty', 'Jane'], ['Mr. Bennet']]]"
"Q47","Now, Kitty, you may cough as much as you chuse,","['Now, Kitty, you may cough as much as you chuse,']","[[8001, 8048]]","Mr. Bennet","['Mary', 'Elizabeth', 'Lydia', 'Mrs. Bennet', 'Kitty']","Explicit","said Mr Bennet","[['Kitty', 'you', 'you']]","[[[8006, 8011], [8013, 8016], [8038, 8041]]]","[[['Kitty'], ['Kitty'], ['Kitty']]]"
