"quoteID","quoteText","subQuotationList","quoteByteSpans","speaker","addressees","quoteType","referringExpression","mentionTextsList","mentionSpansList","mentionEntitiesList"
"Q366","A thorough, determined dislike of me--a dislike which I cannot but
attribute in some measure to jealousy. Had the late Mr. Darcy liked me
less, his son might have borne with me better; but his father's uncommon
attachment to me, irritated him I believe very early in life. He had not
a temper to bear the sort of competition in which we stood--the sort of
preference which was often given me.","[""A thorough, determined dislike of me--a dislike which I cannot but\nattribute in some measure to jealousy. Had the late Mr. Darcy liked me\nless, his son might have borne with me better; but his father's uncommon\nattachment to me, irritated him I believe very early in life. He had not\na temper to bear the sort of competition in which we stood--the sort of\npreference which was often given me.""]","[[136254, 136646]]","George Wickham","['Elizabeth']","Implicit","nan","[['the late Mr. Darcy', 'his son', 'his father', 'him', 'He', 'we']]","[[[136364, 136382], [136398, 136405], [136443, 136453], [136493, 136496], [136527, 136529], [136588, 136590]]]","[[['The Late Mr. Darcy'], ['Mr. Darcy'], ['The Late Mr. Darcy'], ['Mr. Darcy'], ['Mr. Darcy'], ['Mr. Darcy', 'George Wickham']]]"
"Q367","I had not thought Mr. Darcy so bad as this--though I have never liked
him, I had not thought so very ill of him--I had supposed him to be
despising his fellow-creatures in general, but did not suspect him of
descending to such malicious revenge, such injustice, such inhumanity as
this!","['I had not thought Mr. Darcy so bad as this--though I have never liked\nhim, I had not thought so very ill of him--I had supposed him to be\ndespising his fellow-creatures in general, but did not suspect him of\ndescending to such malicious revenge, such injustice, such inhumanity as\nthis!']","[[136650, 136936]]","Elizabeth","['George Wickham']","Implicit","nan","[['Mr. Darcy', 'him', 'him', 'him', 'his', 'him']]","[[[136668, 136677], [136720, 136723], [136758, 136761], [136778, 136781], [136798, 136801], [136851, 136854]]]","[[['Mr. Darcy'], ['Mr. Darcy'], ['Mr. Darcy'], ['Mr. Darcy'], ['Mr. Darcy'], ['Mr. Darcy']]]"
"Q368","I _do_ remember
his boasting one day, at Netherfield, of the implacability of his
resentments, of his having an unforgiving temper. His disposition must
be dreadful.","['I _do_ remember\nhis boasting one day, at Netherfield, of the implacability of his\nresentments, of his having an unforgiving temper. His disposition must\nbe dreadful.']","[[136996, 137161]]","Elizabeth","['George Wickham']","Anaphoric","she continued","[['his', 'his', 'his', 'His']]","[[[137012, 137015], [137074, 137077], [137094, 137097], [137128, 137131]]]","[[['Mr. Darcy'], ['Mr. Darcy'], ['Mr. Darcy'], ['Mr. Darcy']]]"
"Q369","I will not trust myself on the subject, _I_ can
hardly be just to him.","['I will not trust myself on the subject,', '_I_ can\nhardly be just to him.']","[[137165, 137204], [137224, 137254]]","George Wickham","['Elizabeth']","Explicit","replied Wickham","[[], ['him']]","[[], [[137250, 137253]]]","[[], [['Mr. Darcy']]]"
"Q370","To
treat in such a manner, the god-son, the friend, the favourite of his
father! ""A young man too, like _you_, whose very
countenance may vouch for your being amiable"" ""And one, too, who had probably been his own companion from
childhood, connected together, as I think you said, in the closest
manner!""","['To\ntreat in such a manner, the god-son, the friend, the favourite of his\nfather!', '""A young man too, like _you_, whose very\ncountenance may vouch for your being amiable""', '""And one, too, who had probably been his own companion from\nchildhood, connected together, as I think you said, in the closest\nmanner!""']","[[137323, 137403], [137427, 137514], [137547, 137682]]","Elizabeth","['George Wickham']","Explicit","Elizabeth was again deep in thought and after a time exclaimed","[['his\nfather'], [], ['his']]","[[[137392, 137402]], [], [[137584, 137587]]]","[[['The Late Mr. Darcy']], [], [['Mr. Darcy']]]"
"Q371","We were born in the same parish, within the same park, the greatest
part of our youth was passed together; inmates of the same house,
sharing the same amusements, objects of the same parental care. _My_
father began life in the profession which your uncle, Mr. Philips,
appears to do so much credit to--but he gave up every thing to be of use
to the late Mr. Darcy, and devoted all his time to the care of the
Pemberley property. He was most highly esteemed by Mr. Darcy, a most
intimate, confidential friend. Mr. Darcy often acknowledged himself to
be under the greatest obligations to my father's active superintendance,
and when immediately before my father's death, Mr. Darcy gave him a
voluntary promise of providing for me, I am convinced that he felt it to
be as much a debt of gratitude to _him_, as of affection to myself.","[""We were born in the same parish, within the same park, the greatest\npart of our youth was passed together; inmates of the same house,\nsharing the same amusements, objects of the same parental care. _My_\nfather began life in the profession which your uncle, Mr. Philips,\nappears to do so much credit to--but he gave up every thing to be of use\nto the late Mr. Darcy, and devoted all his time to the care of the\nPemberley property. He was most highly esteemed by Mr. Darcy, a most\nintimate, confidential friend. Mr. Darcy often acknowledged himself to\nbe under the greatest obligations to my father's active superintendance,\nand when immediately before my father's death, Mr. Darcy gave him a\nvoluntary promise of providing for me, I am convinced that he felt it to\nbe as much a debt of gratitude to _him_, as of affection to myself.""]","[[137685, 138516]]","George Wickham","['Elizabeth']","Implicit","nan","[['We', 'your uncle', 'Mr. Philips', 'the late Mr. Darcy', 'Mr. Darcy', 'Mr. Darcy', 'himself', 'Mr. Darcy', 'he']]","[[[137685, 137687], [137930, 137940], [137942, 137953], [138031, 138049], [138146, 138155], [138195, 138204], [138224, 138231], [138355, 138364], [138435, 138437]]]","[[['Mr. Darcy', 'George Wickham'], ['Mr. Philips'], ['Mr. Philips'], ['The Late Mr. Darcy'], ['The Late Mr. Darcy'], ['The Late Mr. Darcy'], ['The Late Mr. Darcy'], ['The Late Mr. Darcy'], ['The Late Mr. Darcy']]]"
"Q372","How strange! How abominable!--I wonder that the very
pride of this Mr. Darcy has not made him just to you!--If from no better
motive, that he should not have been too proud to be dishonest,--for
dishonesty I must call it.","['How strange!', 'How abominable!--I wonder that the very\npride of this Mr. Darcy has not made him just to you!--If from no better\nmotive, that he should not have been too proud to be dishonest,--for\ndishonesty I must call it.']","[[138520, 138532], [138552, 138760]]","Elizabeth","['George Wickham']","Explicit","cried Elizabeth","[[], ['Mr. Darcy', 'him', 'you', 'he']]","[[], [[138606, 138615], [138629, 138632], [138641, 138644], [138678, 138680]]]","[[], [['Mr. Darcy'], ['Mr. Darcy'], ['George Wickham'], ['Mr. Darcy']]]"
"Q373","It _is_ wonderful, for almost all his actions may
be traced to pride;--and pride has often been his best friend. It has
connected him nearer with virtue than any other feeling. But we are none
of us consistent; and in his behaviour to me, there were stronger
impulses even than pride.","['It _is_ wonderful,', 'for almost all his actions may\nbe traced to pride;--and pride has often been his best friend. It has\nconnected him nearer with virtue than any other feeling. But we are none\nof us consistent; and in his behaviour to me, there were stronger\nimpulses even than pride.']","[[138764, 138782], [138804, 139069]]","George Wickham","['Elizabeth']","Explicit","replied Wickham","[[], ['his', 'his', 'him', 'his']]","[[], [[138819, 138822], [138881, 138884], [138915, 138918], [139003, 139006]]]","[[], [['Mr. Darcy'], ['Mr. Darcy'], ['Mr. Darcy'], ['Mr. Darcy']]]"
"Q374","Can such abominable pride as his, have ever done him good?","['Can such abominable pride as his, have ever done him good?']","[[139073, 139131]]","Elizabeth","['George Wickham']","Implicit","nan","[['his', 'him']]","[[[139102, 139105], [139122, 139125]]]","[[['Mr. Darcy'], ['Mr. Darcy']]]"
"Q375","Yes. It has often led him to be liberal and generous,--to give his
money freely, to display hospitality, to assist his tenants, and relieve
the poor. Family pride, and _filial_ pride, for he is very proud of what
his father was, have done this. Not to appear to disgrace his family, to
degenerate from the popular qualities, or lose the influence of the
Pemberley House, is a powerful motive. He has also _brotherly_ pride,
which with _some_ brotherly affection, makes him a very kind and careful
guardian of his sister; and you will hear him generally cried up as the
most attentive and best of brothers.","['Yes. It has often led him to be liberal and generous,--to give his\nmoney freely, to display hospitality, to assist his tenants, and relieve\nthe poor. Family pride, and _filial_ pride, for he is very proud of what\nhis father was, have done this. Not to appear to disgrace his family, to\ndegenerate from the popular qualities, or lose the influence of the\nPemberley House, is a powerful motive. He has also _brotherly_ pride,\nwhich with _some_ brotherly affection, makes him a very kind and careful\nguardian of his sister; and you will hear him generally cried up as the\nmost attentive and best of brothers.']","[[139135, 139740]]","George Wickham","['Elizabeth']","Implicit","nan","[['him', 'his', 'his', 'he', 'his father', 'his', 'He', 'him', 'his sister', 'him']]","[[[139157, 139160], [139198, 139201], [139250, 139253], [139323, 139325], [139348, 139358], [139406, 139409], [139528, 139530], [139604, 139607], [139644, 139654], [139674, 139677]]]","[[['Mr. Darcy'], ['Mr. Darcy'], ['Mr. Darcy'], ['Mr. Darcy'], ['The Late Mr. Darcy'], ['Mr. Darcy'], ['Mr. Darcy'], ['Mr. Darcy'], ['Miss Darcy'], ['Mr. Darcy']]]"
"Q376","What sort of a girl is Miss Darcy?","['What sort of a girl is Miss Darcy?']","[[139744, 139778]]","Elizabeth","['George Wickham']","Implicit","nan","[['Miss Darcy']]","[[[139767, 139777]]]","[[['Miss Darcy']]]"
"Q377","I wish I could call her amiable. It gives me pain
to speak ill of a Darcy. But she is too much like her brother,--very,
very proud.--As a child, she was affectionate and pleasing, and
extremely fond of me; and I have devoted hours and hours to her
amusement. But she is nothing to me now. She is a handsome girl, about
fifteen or sixteen, and I understand highly accomplished. Since her
father's death, her home has been London, where a lady lives with her,
and superintends her education.","[""I wish I could call her amiable. It gives me pain\nto speak ill of a Darcy. But she is too much like her brother,--very,\nvery proud.--As a child, she was affectionate and pleasing, and\nextremely fond of me; and I have devoted hours and hours to her\namusement. But she is nothing to me now. She is a handsome girl, about\nfifteen or sixteen, and I understand highly accomplished. Since her\nfather's death, her home has been London, where a lady lives with her,\nand superintends her education.""]","[[139802, 140291]]","George Wickham","['Elizabeth']","Implicit","nan","[['her', 'she', 'her brother', 'she', 'her', 'she', 'She', 'her\nfather', 'her', 'her', 'her']]","[[[139822, 139825], [139881, 139884], [139902, 139913], [139947, 139950], [140046, 140049], [140065, 140068], [140091, 140094], [140185, 140195], [140205, 140208], [140255, 140258], [140277, 140280]]]","[[['Miss Darcy'], ['Miss Darcy'], ['Mr. Darcy'], ['Miss Darcy'], ['Miss Darcy'], ['Miss Darcy'], ['Miss Darcy'], ['The Late Mr. Darcy'], ['Miss Darcy'], ['Miss Darcy'], ['Miss Darcy']]]"
"Q378","I am astonished at his intimacy with Mr. Bingley! How can Mr. Bingley,
who seems good humour itself, and is, I really believe, truly amiable,
be in friendship with such a man? How can they suit each other?--Do you
know Mr. Bingley?","['I am astonished at his intimacy with Mr. Bingley! How can Mr. Bingley,\nwho seems good humour itself, and is, I really believe, truly amiable,\nbe in friendship with such a man? How can they suit each other?--Do you\nknow Mr. Bingley?']","[[140420, 140651]]","Elizabeth","['George Wickham']","Explicit","Elizabeth could not help reverting once more to the first and saying","[['his', 'Mr. Bingley', 'Mr. Bingley', 'they', 'you', 'Mr. Bingley']]","[[[140439, 140442], [140457, 140468], [140478, 140489], [140604, 140608], [140630, 140633], [140639, 140650]]]","[[['Mr. Darcy'], ['Mr. Bingley'], ['Mr. Bingley'], ['Mr. Darcy', 'Mr. Bingley'], ['George Wickham'], ['Mr. Bingley']]]"
"Q379","Not at all.","['Not at all.']","[[140655, 140666]]","George Wickham","['Elizabeth']","Implicit","nan","[[]]","[[]]","[[]]"
"Q380","He is a sweet tempered, amiable, charming man. He cannot know what Mr.
Darcy is.","['He is a sweet tempered, amiable, charming man. He cannot know what Mr.\nDarcy is.']","[[140670, 140750]]","Elizabeth","['George Wickham']","Implicit","nan","[['He', 'He', 'Mr.\nDarcy']]","[[[140670, 140672], [140717, 140719], [140737, 140746]]]","[[['Mr. Bingley'], ['Mr. Bingley'], ['Mr. Darcy']]]"
"Q381","Probably not;--but Mr. Darcy can please where he chuses. He does not
want abilities. He can be a conversible companion if he thinks it worth
his while. Among those who are at all his equals in consequence, he is a
very different man from what he is to the less prosperous. His pride
never deserts him; but with the rich, he is liberal-minded, just,
sincere, rational, honourable, and perhaps agreeable,--allowing
something for fortune and figure.","['Probably not;--but Mr. Darcy can please where he chuses. He does not\nwant abilities. He can be a conversible companion if he thinks it worth\nhis while. Among those who are at all his equals in consequence, he is a\nvery different man from what he is to the less prosperous. His pride\nnever deserts him; but with the rich, he is liberal-minded, just,\nsincere, rational, honourable, and perhaps agreeable,--allowing\nsomething for fortune and figure.']","[[140754, 141200]]","George Wickham","['Elizabeth']","Implicit","nan","[['Mr. Darcy', 'he', 'He', 'He', 'he', 'his', 'his', 'he', 'he', 'His', 'him', 'he']]","[[[140773, 140782], [140800, 140802], [140811, 140813], [140839, 140841], [140876, 140878], [140895, 140898], [140933, 140936], [140960, 140962], [140997, 140999], [141027, 141030], [141051, 141054], [141075, 141077]]]","[[['Mr. Darcy'], ['Mr. Darcy'], ['Mr. Darcy'], ['Mr. Darcy'], ['Mr. Darcy'], ['Mr. Darcy'], ['Mr. Darcy'], ['Mr. Darcy'], ['Mr. Darcy'], ['Mr. Darcy'], ['Mr. Darcy'], ['Mr. Darcy']]]"
"Q382","I know very well, madam, that when persons sit down to a
card table, they must take their chance of these things,--and happily I
am not in such circumstances as to make five shillings any object. There
are undoubtedly many who could not say the same, but thanks to Lady
Catherine de Bourgh, I am removed far beyond the necessity of regarding
little matters.","['I know very well, madam,', 'that when persons sit down to a\ncard table, they must take their chance of these things,--and happily I\nam not in such circumstances as to make five shillings any object. There\nare undoubtedly many who could not say the same, but thanks to Lady\nCatherine de Bourgh, I am removed far beyond the necessity of regarding\nlittle matters.']","[[141728, 141752], [141764, 142096]]","Mr. Collins","['Mary', 'Elizabeth', 'Lydia', 'Kitty', 'Jane', 'Mrs. Philips', 'George Wickham']","Anaphoric","said he","[['madam'], ['Lady\nCatherine de Bourgh']]","[[[141746, 141751]], [[142004, 142028]]]","[[['Mrs. Philips']], [['Lady Catherine De Bourgh']]]"
"Q383","Lady Catherine de Bourgh, has very lately given him a
living. I hardly know how Mr. Collins was first introduced to her
notice, but he certainly has not known her long.","['Lady Catherine de Bourgh,', 'has very lately given him a\nliving. I hardly know how Mr. Collins was first introduced to her\nnotice, but he certainly has not known her long.']","[[142305, 142330], [142346, 142488]]","Elizabeth","['George Wickham']","Anaphoric","she replied","[['Lady Catherine de Bourgh'], ['him', 'Mr. Collins', 'her', 'he', 'her']]","[[[142305, 142329]], [[142368, 142371], [142400, 142411], [142436, 142439], [142452, 142454], [142479, 142482]]]","[[['Lady Catherine De Bourgh']], [['Mr. Collins'], ['Mr. Collins'], ['Lady Catherine De Bourgh'], ['Mr. Collins'], ['Lady Catherine De Bourgh']]]"
"Q384","You know of course that Lady Catherine de Bourgh and Lady Anne Darcy
were sisters; consequently that she is aunt to the present Mr. Darcy.","['You know of course that Lady Catherine de Bourgh and Lady Anne Darcy\nwere sisters; consequently that she is aunt to the present Mr. Darcy.']","[[142492, 142630]]","George Wickham","['Elizabeth']","Implicit","nan","[['You', 'Lady Catherine de Bourgh', 'Lady Anne Darcy', 'she']]","[[[142492, 142495], [142516, 142540], [142545, 142560], [142593, 142596]]]","[[['Elizabeth'], ['Lady Catherine De Bourgh'], ['Lady Anne Darcy'], ['Lady Catherine De Bourgh']]]"
"Q385","No, indeed, I did not.--I knew nothing at all of Lady Catherine's
connections. I never heard of her existence till the day before
yesterday.","[""No, indeed, I did not.--I knew nothing at all of Lady Catherine's\nconnections. I never heard of her existence till the day before\nyesterday.""]","[[142634, 142774]]","Elizabeth","['George Wickham']","Implicit","nan","[['Lady Catherine', 'her']]","[[[142683, 142697], [142730, 142733]]]","[[['Lady Catherine De Bourgh'], ['Lady Catherine De Bourgh']]]"
"Q386","Her daughter, Miss de Bourgh, will have a very large fortune, and it is
believed that she and her cousin will unite the two estates.","['Her daughter, Miss de Bourgh, will have a very large fortune, and it is\nbelieved that she and her cousin will unite the two estates.']","[[142778, 142910]]","George Wickham","['Elizabeth']","Implicit","nan","[['Her daughter', 'Miss de Bourgh', 'she', 'her cousin']]","[[[142778, 142790], [142792, 142806], [142864, 142867], [142872, 142882]]]","[[['Miss De Bourgh'], ['Miss De Bourgh'], ['Miss De Bourgh'], ['Mr. Darcy']]]"
"Q387","Mr. Collins, speaks highly both of Lady Catherine and her
daughter; but from some particulars that he has related of her ladyship,
I suspect his gratitude misleads him, and that in spite of her being his
patroness, she is an arrogant, conceited woman.","['Mr. Collins,', 'speaks highly both of Lady Catherine and her\ndaughter; but from some particulars that he has related of her ladyship,\nI suspect his gratitude misleads him, and that in spite of her being his\npatroness, she is an arrogant, conceited woman.']","[[143149, 143161], [143174, 143412]]","Elizabeth","['George Wickham']","Anaphoric","said she","[['Mr. Collins'], ['Lady Catherine', 'her\ndaughter', 'he', 'her ladyship', 'his', 'him', 'her', 'his', 'she']]","[[[143149, 143160]], [[143196, 143210], [143215, 143227], [143260, 143262], [143278, 143290], [143302, 143305], [143325, 143328], [143351, 143354], [143361, 143364], [143376, 143379]]]","[[['Mr. Collins']], [['Lady Catherine De Bourgh'], ['Miss De Bourgh'], ['Mr. Collins'], ['Lady Catherine De Bourgh'], ['Mr. Collins'], ['Mr. Collins'], ['Lady Catherine De Bourgh'], ['Mr. Collins'], ['Lady Catherine De Bourgh']]]"
"Q388","I believe her to be both in a great degree, I have
not seen her for many years, but I very well remember that I never liked
her, and that her manners were dictatorial and insolent. She has the
reputation of being remarkably sensible and clever; but I rather believe
she derives part of her abilities from her rank and fortune, part from
her authoritative manner, and the rest from the pride of her nephew, who
chuses that every one connected with him should have an understanding of
the first class.","['I believe her to be both in a great degree,', 'I have\nnot seen her for many years, but I very well remember that I never liked\nher, and that her manners were dictatorial and insolent. She has the\nreputation of being remarkably sensible and clever; but I rather believe\nshe derives part of her abilities from her rank and fortune, part from\nher authoritative manner, and the rest from the pride of her nephew, who\nchuses that every one connected with him should have an understanding of\nthe first class.']","[[143416, 143459], [143479, 143934]]","George Wickham","['Elizabeth']","Explicit","replied Wickham","[['her'], ['her', 'her', 'her', 'She', 'she', 'her', 'her', 'her', 'her nephew', 'him']]","[[[143426, 143429]], [[143495, 143498], [143559, 143562], [143573, 143576], [143616, 143619], [143701, 143704], [143721, 143724], [143740, 143743], [143772, 143775], [143829, 143839], [143882, 143885]]]","[[['Lady Catherine De Bourgh']], [['Lady Catherine De Bourgh'], ['Lady Catherine De Bourgh'], ['Lady Catherine De Bourgh'], ['Lady Catherine De Bourgh'], ['Lady Catherine De Bourgh'], ['Lady Catherine De Bourgh'], ['Lady Catherine De Bourgh'], ['Lady Catherine De Bourgh'], ['Mr. Darcy'], ['Mr. Darcy']]]"
"Q389","They have both, been deceived, I dare say, in some way or
other, of which we can form no idea. Interested people have perhaps
misrepresented each to the other. It is, in short, impossible for us to
conjecture the causes or circumstances which may have alienated them,
without actual blame on either side.","['They have both,', 'been deceived, I dare say, in some way or\nother, of which we can form no idea. Interested people have perhaps\nmisrepresented each to the other. It is, in short, impossible for us to\nconjecture the causes or circumstances which may have alienated them,\nwithout actual blame on either side.']","[[145711, 145726], [145739, 146027]]","Jane","['Elizabeth']","Anaphoric","said she","[['They'], ['we', 'us', 'them']]","[[[145711, 145715]], [[145797, 145799], [145915, 145917], [145985, 145989]]]","[[['Mr. Darcy', 'George Wickham']], [['Elizabeth', 'Jane'], ['Elizabeth', 'Jane'], ['Mr. Darcy', 'George Wickham']]]"
"Q390","Very true, indeed;--and now, my dear Jane, what have you got to say in
behalf of the interested people who have probably been concerned in the
business?--Do clear _them_ too, or we shall be obliged to think ill of
somebody.","['Very true, indeed;--and now, my dear Jane, what have you got to say in\nbehalf of the interested people who have probably been concerned in the\nbusiness?--Do clear _them_ too, or we shall be obliged to think ill of\nsomebody.']","[[146031, 146254]]","Elizabeth","['Jane']","Implicit","nan","[['my dear Jane', 'you', 'we']]","[[[146060, 146072], [146084, 146087], [146209, 146211]]]","[[['Jane'], ['Jane'], ['Elizabeth', 'Jane']]]"
"Q391","Laugh as much as you chuse, but you will not laugh me out of my
opinion. My dearest Lizzy, do but consider in what a disgraceful light
it places Mr. Darcy, to be treating his father's favourite in such a
manner,--one, whom his father had promised to provide for.--It is
impossible. No man of common humanity, no man who had any value for his
character, could be capable of it. Can his most intimate friends be so
excessively deceived in him? oh! no.","[""Laugh as much as you chuse, but you will not laugh me out of my\nopinion. My dearest Lizzy, do but consider in what a disgraceful light\nit places Mr. Darcy, to be treating his father's favourite in such a\nmanner,--one, whom his father had promised to provide for.--It is\nimpossible. No man of common humanity, no man who had any value for his\ncharacter, could be capable of it. Can his most intimate friends be so\nexcessively deceived in him? oh! no.""]","[[146258, 146707]]","Jane","['Elizabeth']","Implicit","nan","[['you', 'you', 'My dearest Lizzy', 'Mr. Darcy', 'his father', 'his', 'him']]","[[[146275, 146278], [146290, 146293], [146331, 146347], [146403, 146412], [146481, 146491], [146639, 146642], [146695, 146698]]]","[[['Elizabeth'], ['Elizabeth'], ['Elizabeth'], ['Mr. Darcy'], ['The Late Mr. Darcy'], ['Mr. Darcy'], ['Mr. Darcy']]]"
"Q392","I can much more easily believe Mr. Bingley's being imposed on, than
that Mr. Wickham should invent such a history of himself as he gave me
last night; names, facts, every thing mentioned without ceremony.--If it
be not so, let Mr. Darcy contradict it. Besides, there was truth in his
looks.","[""I can much more easily believe Mr. Bingley's being imposed on, than\nthat Mr. Wickham should invent such a history of himself as he gave me\nlast night; names, facts, every thing mentioned without ceremony.--If it\nbe not so, let Mr. Darcy contradict it. Besides, there was truth in his\nlooks.""]","[[146711, 147001]]","Elizabeth","['Jane']","Implicit","nan","[['Mr. Bingley', 'Mr. Wickham', 'himself', 'he', 'Mr. Darcy']]","[[[146742, 146753], [146784, 146795], [146828, 146835], [146839, 146841], [146938, 146947]]]","[[['Mr. Bingley'], ['George Wickham'], ['George Wickham'], ['George Wickham'], ['Mr. Darcy']]]"
"Q393","It is difficult indeed--it is distressing.--One does not know what to
think.","['It is difficult indeed--it is distressing.--One does not know what to\nthink.']","[[147005, 147081]]","Jane","['Elizabeth']","Implicit","nan","[[]]","[[]]","[[]]"
"Q394","I beg your pardon;--one knows exactly what to think.","['I beg your pardon;--one knows exactly what to think.']","[[147085, 147137]]","Elizabeth","['Jane']","Implicit","nan","[['your']]","[[[147091, 147095]]]","[[['Jane']]]"
