quoteID,quoteText,subQuotationList,quoteByteSpans,speaker,addressees,quoteType,referringExpression,mentionTextsList,mentionSpansList,mentionEntitiesList
Q452,"Did you hear, though, they are remarking on the cold? I should never have thought it cold. What a
religion! Foreigners are a filthy nation, I don t care
if there are tunnels; open the windows.","['Did you hear, though, they are remarking on the cold?', 'I should never have thought it cold.', 'What a\nreligion!', 'Foreigners are a filthy nation,', 'I don t care\nif there are tunnels; open the windows.']","[[140309, 140362], [140389, 140425], [141107, 141123], [141544, 141575], [141592, 141644]]",Harriet,['Mr. Herriton'],Explicit,said Harriet,"[['you'], [], [], [], []]","[[[140313, 140316]], [], [], [], []]","[[['Mr. Herriton']], [], [], [], []]"
Q453,Singles or returns?,['Singles or returns?'],"[[142125, 142144]]",Mr. Herriton,['Harriet'],Anaphoric,said he,[[]],[[]],[[]]
Q454,"A single for me, I shall never get back
alive.","['A single for me,', 'I shall never get back\nalive.']","[[142157, 142173], [142200, 142229]]",Harriet,['Mr. Herriton'],Explicit,said Harriet,"[[], []]","[[], []]","[[], []]"
Q455,"Sweet creature! How helpful
you will be when we come to Signor Carella!","['Sweet creature!', 'How helpful\nyou will be when we come to Signor Carella!']","[[142233, 142248], [142293, 142348]]",Mr. Herriton,['Harriet'],Anaphoric,said her brother,"[[], ['you', 'we', 'Signor Carella']]","[[], [[142305, 142308], [142322, 142324], [142333, 142347]]]","[[], [['Harriet'], ['Harriet', 'Mr. Herriton'], ['Signor Carella']]]"
Q456,"Do you suppose, do you suppose I am going to enter that man s house?","['Do you suppose,', 'do you suppose I am going to enter that man s house?']","[[142352, 142367], [142425, 142477]]",Harriet,['Mr. Herriton'],Explicit,said Harriet,"[['you'], ['you']]","[[[142355, 142358]], [[142428, 142431]]]","[[['Mr. Herriton']], [['Mr. Herriton']]]"
Q457,"Then what have you come for, pray? For ornament?","['Then what have you come for, pray? For ornament?']","[[142481, 142529]]",Mr. Herriton,['Harriet'],Implicit,,[['you']],"[[[142496, 142499]]]",[[['Harriet']]]
Q458,To see that you do your duty.,['To see that you do your duty.'],"[[142533, 142562]]",Harriet,['Mr. Herriton'],Implicit,,"[['you', 'your']]","[[[142545, 142548], [142552, 142556]]]","[[['Mr. Herriton'], ['Mr. Herriton']]]"
Q459,"Oh, thanks!","['Oh, thanks!']","[[142566, 142577]]",Mr. Herriton,['Harriet'],Implicit,,[[]],[[]],[[]]
Q460,"So mother told me. For goodness sake get the tickets; here comes that
hot woman again! She has the impudence to bow.",['So mother told me. For goodness sake get the tickets; here comes that\nhot woman again! She has the impudence to bow.'],"[[142581, 142697]]",Harriet,['Mr. Herriton'],Implicit,,[[]],[[]],[[]]
Q461,"Mother told you, did she?","['Mother told you, did she?']","[[142701, 142726]]",Mr. Herriton,['Harriet'],Explicit,said Philip,"[['you', 'she']]","[[[142713, 142716], [142722, 142725]]]","[[['Harriet'], ['Mrs. Herriton']]]"
Q462,But do people live inside?,['But do people live inside?'],"[[143705, 143731]]",Harriet,['Mr. Herriton'],Explicit,asked Harriet,[[]],[[]],[[]]
Q463,No.,['No.'],"[[143928, 143931]]",Mr. Herriton,['Harriet'],Explicit,Philip to be annoying answered,[[]],[[]],[[]]
Q464,What do they do there?,['What do they do there?'],"[[143935, 143957]]",Harriet,['Mr. Herriton'],Explicit,continued Harriet,[[]],[[]],[[]]
Q465,There is a caffe. A prison. A theatre. A church. Walls. A view.,['There is a caffe. A prison. A theatre. A church. Walls. A view.'],"[[143994, 144057]]",Mr. Herriton,['Harriet'],Implicit,,[[]],[[]],[[]]
Q466,"Not for me, thank you,","['Not for me, thank you,']","[[144061, 144083]]",Harriet,['Mr. Herriton'],Explicit,said Harriet,[['you']],"[[[144079, 144082]]]",[[['Mr. Herriton']]]
Q467,"Nobody asked you, Miss, you see. Now Lilia was asked by such a nice
young gentleman, with curls all over his forehead, and teeth just as
white as father makes them.","['Nobody asked you, Miss, you see. Now Lilia was asked by such a nice\nyoung gentleman, with curls all over his forehead, and teeth just as\nwhite as father makes them.']","[[144124, 144288]]",Mr. Herriton,['Harriet'],Implicit,,"[['you', 'Miss', 'you', 'Lilia', 'his']]","[[[144137, 144140], [144142, 144146], [144148, 144151], [144161, 144166], [144229, 144232]]]","[[['Harriet'], ['Harriet'], ['Harriet'], ['Lilia'], ['Signor Carella']]]"
Q468,"But, Harriet, do
you see nothing wonderful or attractive in that place--nothing at all?","['But, Harriet, do\nyou see nothing wonderful or attractive in that place--nothing at all?']","[[144316, 144403]]",Mr. Herriton,['Harriet'],Implicit,,"[['Harriet', 'you']]","[[[144321, 144328], [144333, 144336]]]","[[['Harriet'], ['Harriet']]]"
Q469,Nothing at all. It s frightful.,['Nothing at all. It s frightful.'],"[[144407, 144438]]",Harriet,['Mr. Herriton'],Implicit,,[[]],[[]],[[]]
Q470,I know it is. But it s old--awfully old.,['I know it is. But it s old--awfully old.'],"[[144442, 144482]]",Mr. Herriton,['Harriet'],Implicit,,[[]],[[]],[[]]
Q471,"Beauty is the only test, At least so you told me when
I sketched old buildings--for the sake, I suppose, of making yourself
unpleasant.","['Beauty is the only test,', 'At least so you told me when\nI sketched old buildings--for the sake, I suppose, of making yourself\nunpleasant.']","[[144486, 144510], [144527, 144637]]",Harriet,['Mr. Herriton'],Explicit,said Harriet,"[[], ['you', 'yourself']]","[[], [[144539, 144542], [144617, 144625]]]","[[], [['Mr. Herriton'], ['Mr. Herriton']]]"
Q472,"Oh, I m perfectly right. But at the same time--I don t know--so
many things have happened here--people have lived so hard and so
splendidly--I can t explain.","['Oh, I m perfectly right. But at the same time--I don t know--so\nmany things have happened here--people have lived so hard and so\nsplendidly--I can t explain.']","[[144641, 144798]]",Mr. Herriton,['Harriet'],Implicit,,[[]],[[]],[[]]
Q473,"I shouldn t think you could. It doesn t seem the best moment to begin
your Italy mania. I thought you were cured of it by now. Instead, will
you kindly tell me what you are going to do when you arrive. I do beg
you will not be taken unawares this time.","['I shouldn t think you could. It doesn t seem the best moment to begin\nyour Italy mania. I thought you were cured of it by now. Instead, will\nyou kindly tell me what you are going to do when you arrive. I do beg\nyou will not be taken unawares this time.']","[[144802, 145054]]",Harriet,['Mr. Herriton'],Implicit,,"[['you', 'your', 'you', 'you', 'you', 'you', 'you']]","[[[144820, 144823], [144872, 144876], [144900, 144903], [144943, 144946], [144967, 144970], [144992, 144995], [145013, 145016]]]","[[['Mr. Herriton'], ['Mr. Herriton'], ['Mr. Herriton'], ['Mr. Herriton'], ['Mr. Herriton'], ['Mr. Herriton'], ['Mr. Herriton']]]"
Q474,"First, Harriet, I shall settle you at the Stella d Italia, in the
comfort that befits your sex and disposition. Then I shall make myself
some tea. After tea I shall take a book into Santa Deodata s, and read
there. It is always fresh and cool.","['First, Harriet, I shall settle you at the Stella d Italia, in the\ncomfort that befits your sex and disposition. Then I shall make myself\nsome tea. After tea I shall take a book into Santa Deodata s, and read\nthere. It is always fresh and cool.']","[[145058, 145301]]",Mr. Herriton,['Harriet'],Implicit,,"[['Harriet', 'you', 'your']]","[[[145065, 145072], [145089, 145092], [145144, 145148]]]","[[['Harriet'], ['Harriet'], ['Harriet']]]"
Q475,"I m not clever, Philip. I don t go in
for it, as you know. But I know what s rude. And I know what s wrong.","['I m not clever, Philip. I don t go in\nfor it, as you know. But I know what s rude. And I know what s wrong.']","[[145337, 145444]]",Harriet,['Mr. Herriton'],Explicit,Harriet exclaimed,"[['Philip', 'you']]","[[[145353, 145359], [145386, 145389]]]","[[['Mr. Herriton'], ['Mr. Herriton']]]"
Q476,Meaning--?,['Meaning--?'],"[[145448, 145458]]",Mr. Herriton,['Harriet'],Implicit,,[[]],[[]],[[]]
Q477,"You! What s the good of cleverness if a man s murdered a
woman?","['You!', 'What s the good of cleverness if a man s murdered a\nwoman?']","[[145462, 145466], [145549, 145607]]",Harriet,['Mr. Herriton'],Anaphoric,she shouted,"[['You'], []]","[[[145462, 145465]], []]","[[['Mr. Herriton']], []]"
Q478,"Harriet, I am hot. To whom do you refer?","['Harriet, I am hot. To whom do you refer?']","[[145611, 145651]]",Mr. Herriton,['Harriet'],Implicit,,"[['Harriet', 'you']]","[[[145611, 145618], [145641, 145644]]]","[[['Harriet'], ['Harriet']]]"
Q479,He. Her. If you don t look out he ll murder you. I wish he would.,['He. Her. If you don t look out he ll murder you. I wish he would.'],"[[145655, 145720]]",Harriet,['Mr. Herriton'],Implicit,,"[['He', 'Her', 'you', 'he', 'you', 'he']]","[[[145655, 145657], [145659, 145662], [145667, 145670], [145686, 145688], [145699, 145702], [145711, 145713]]]","[[['Signor Carella'], ['Lilia'], ['Mr. Herriton'], ['Signor Carella'], ['Mr. Herriton'], ['Signor Carella']]]"
Q480,"Tut tut, tutlet! You d find a corpse extraordinarily inconvenient.","['Tut tut, tutlet! You d find a corpse extraordinarily inconvenient.']","[[145724, 145790]]",Mr. Herriton,['Harriet'],Implicit,,[['You']],"[[[145741, 145744]]]",[[['Harriet']]]
Q481,"I heartily dislike the fellow,
but we know he didn t murder her. In that letter, though she said a lot,
she never said he was physically cruel.","['I heartily dislike the fellow,\nbut we know he didn t murder her. In that letter, though she said a lot,\nshe never said he was physically cruel.']","[[145832, 145975]]",Mr. Herriton,['Harriet'],Implicit,,"[['we', 'he', 'her', 'she', 'she', 'he']]","[[[145867, 145869], [145875, 145877], [145892, 145895], [145920, 145923], [145936, 145939], [145951, 145953]]]","[[['Harriet', 'Mr. Herriton'], ['Signor Carella'], ['Lilia'], ['Lilia'], ['Lilia'], ['Signor Carella']]]"
Q482,"He has murdered her. The things he did--things one can t even
mention--",['He has murdered her. The things he did--things one can t even\nmention--'],"[[145979, 146050]]",Harriet,['Mr. Herriton'],Implicit,,"[['He', 'her', 'he']]","[[[145979, 145981], [145995, 145998], [146011, 146013]]]","[[['Signor Carella'], ['Lilia'], ['Signor Carella']]]"
Q483,"Things which one must mention if one s to talk at all. And things which
one must keep in their proper place. Because he was unfaithful to his
wife, it doesn t follow that in every way he s absolutely vile.","['Things which one must mention if one s to talk at all. And things which\none must keep in their proper place. Because he was unfaithful to his\nwife, it doesn t follow that in every way he s absolutely vile.']","[[146054, 146259]]",Mr. Herriton,['Harriet'],Implicit,,"[['he', 'his', 'he']]","[[[146171, 146173], [146192, 146195], [146238, 146240]]]","[[['Signor Carella'], ['Signor Carella'], ['Signor Carella']]]"
Q484,It s the supreme test. The man who is unchivalrous to a woman--,['It s the supreme test. The man who is unchivalrous to a woman--'],"[[146319, 146382]]",Harriet,['Mr. Herriton'],Implicit,,[[]],[[]],[[]]
Q485,"Oh, stow it! Take it to the Back Kitchen. It s no more a supreme test
than anything else. The Italians never were chivalrous from the first.
If you condemn him for that, you ll condemn the whole lot.","['Oh, stow it! Take it to the Back Kitchen. It s no more a supreme test\nthan anything else. The Italians never were chivalrous from the first.\nIf you condemn him for that, you ll condemn the whole lot.']","[[146386, 146585]]",Mr. Herriton,['Harriet'],Implicit,,"[['you', 'him', 'you']]","[[[146530, 146533], [146542, 146545], [146556, 146559]]]","[[['Harriet'], ['Signor Carella'], ['Harriet']]]"
Q486,I condemn the whole lot.,['I condemn the whole lot.'],"[[146589, 146613]]",Harriet,['Mr. Herriton'],Implicit,,[[]],[[]],[[]]
Q487,And the French as well?,['And the French as well?'],"[[146617, 146640]]",Mr. Herriton,['Harriet'],Implicit,,[[]],[[]],[[]]
Q488,And the French as well.,['And the French as well.'],"[[146644, 146667]]",Harriet,['Mr. Herriton'],Implicit,,[[]],[[]],[[]]
Q489,"Things aren t so jolly easy,","['Things aren t so jolly easy,']","[[146671, 146699]]",Mr. Herriton,['Harriet'],Explicit,said Philip,[[]],[[]],[[]]
Q490,"What about the baby, pray? You ve said a lot of
smart things and whittled away morality and religion and I don t know
what; but what about the baby? You think me a fool, but I ve been
noticing you all today, and you haven t mentioned the baby once. You
haven t thought about it, even. You don t care. Philip! I shall not
speak to you. You are intolerable.","['What about the baby, pray? You ve said a lot of\nsmart things and whittled away morality and religion and I don t know\nwhat; but what about the baby? You think me a fool, but I ve been\nnoticing you all today, and you haven t mentioned the baby once. You\nhaven t thought about it, even. You don t care. Philip! I shall not\nspeak to you. You are intolerable.']","[[146840, 147195]]",Harriet,['Mr. Herriton'],Implicit,,"[['You', 'You', 'you', 'you', 'You', 'You', 'Philip', 'you', 'You']]","[[[146867, 146870], [146989, 146992], [147033, 147036], [147052, 147055], [147089, 147092], [147125, 147128], [147141, 147147], [147170, 147173], [147175, 147178]]]","[[['Mr. Herriton'], ['Mr. Herriton'], ['Mr. Herriton'], ['Mr. Herriton'], ['Mr. Herriton'], ['Mr. Herriton'], ['Mr. Herriton'], ['Mr. Herriton'], ['Mr. Herriton']]]"
Q491,Go!,['Go!'],"[[150485, 150488]]",Harriet,['Mr. Herriton'],Explicit,Harriet pronounced the monosyllable,[[]],[[]],[[]]
Q492,Go where?,['Go where?'],"[[150492, 150501]]",Mr. Herriton,['Harriet'],Explicit,asked Philip,[[]],[[]],[[]]
Q493,To the Italian. Go.,['To the Italian. Go.'],"[[150577, 150596]]",Harriet,['Mr. Herriton'],Implicit,,[[]],[[]],[[]]
Q494,"Buona sera, signora padrona. Si ritorna volontieri a Monteriano!","['Buona sera, signora padrona. Si ritorna volontieri a Monteriano!']","[[150600, 150664]]",Mr. Herriton,['The Landlady'],Implicit,,[[]],[[]],[[]]
Q495,"Vorrei
due camere--",['Vorrei\ndue camere--'],"[[150731, 150750]]",Mr. Herriton,['The Landlady'],Implicit,,[[]],[[]],[[]]
Q496,Go. This instant. Now. I ll stand it no longer. Go!,['Go. This instant. Now. I ll stand it no longer. Go!'],"[[150754, 150805]]",Harriet,['Mr. Herriton'],Implicit,,[[]],[[]],[[]]
Q497,I m damned if I ll go. I want my tea.,['I m damned if I ll go. I want my tea.'],"[[150809, 150846]]",Mr. Herriton,['Harriet'],Implicit,,[[]],[[]],[[]]
Q498,"Swear if you like! Blaspheme! Abuse me! But understand,
I m in earnest.","['Swear if you like!', 'Blaspheme! Abuse me! But understand,\nI m in earnest.']","[[150850, 150868], [150882, 150934]]",Harriet,['Mr. Herriton'],Anaphoric,she cried,"[['you'], []]","[[[150859, 150862]], []]","[[['Mr. Herriton']], []]"
Q499,"Harriet, don t act. Or act better.","['Harriet, don t act. Or act better.']","[[150938, 150972]]",Mr. Herriton,['Harriet'],Implicit,,[['Harriet']],"[[[150938, 150945]]]",[[['Harriet']]]
Q500,"We ve come here to get the baby back, and for nothing else. I ll not
have this levity and slackness, and talk about pictures and churches.
Think of mother; did she send you out for THEM?","['We ve come here to get the baby back, and for nothing else. I ll not\nhave this levity and slackness, and talk about pictures and churches.\nThink of mother; did she send you out for THEM?']","[[150976, 151162]]",Harriet,['Mr. Herriton'],Implicit,,"[['We', 'she', 'you']]","[[[150976, 150978], [151136, 151139], [151145, 151148]]]","[[['Harriet', 'Mr. Herriton'], ['Mrs. Herriton'], ['Mr. Herriton']]]"
Q501,"Think of mother and don t straddle across the stairs. Let the cabman
and the landlady come down, and let me go up and choose rooms.","['Think of mother and don t straddle across the stairs. Let the cabman\nand the landlady come down, and let me go up and choose rooms.']","[[151166, 151297]]",Mr. Herriton,['Harriet'],Implicit,,[[]],[[]],[[]]
Q502,I shan t.,['I shan t.'],"[[151301, 151310]]",Harriet,['Mr. Herriton'],Implicit,,[[]],[[]],[[]]
Q503,"Harriet, are you mad?","['Harriet, are you mad?']","[[151314, 151335]]",Mr. Herriton,['Harriet'],Implicit,,"[['Harriet', 'you']]","[[[151314, 151321], [151327, 151330]]]","[[['Harriet'], ['Harriet']]]"
Q504,If you like. But you will not come up till you have seen the Italian.,['If you like. But you will not come up till you have seen the Italian.'],"[[151339, 151408]]",Harriet,['Mr. Herriton'],Implicit,,"[['you', 'you', 'you']]","[[[151342, 151345], [151356, 151359], [151382, 151385]]]","[[['Mr. Herriton'], ['Mr. Herriton'], ['Mr. Herriton']]]"
Q505,"La signorina si sente male, C  e il sole.","['La signorina si sente male,', 'C  e il sole.']","[[151412, 151439], [151455, 151468]]",Mr. Herriton,['The Landlady'],Explicit,said Philip,"[[], []]","[[], []]","[[], []]"
Q506,Poveretta!,['Poveretta!'],"[[151472, 151482]]",_group,"['Harriet', 'Mr. Herriton']",Explicit,cried the landlady and the cabman,[[]],[[]],[[]]
Q507,"Leave me alone! I don t care
for the lot of you. I m English, and neither you ll come down nor he up
till he goes for the baby.","['Leave me alone!', 'I don t care\nfor the lot of you. I m English, and neither you ll come down nor he up\ntill he goes for the baby.']","[[151521, 151536], [151577, 151688]]",Harriet,['_group'],Explicit,said Harriet,"[[], ['you', 'he', 'he']]","[[], [[151635, 151638], [151656, 151658], [151667, 151669]]]","[[], [['The Landlady'], ['Mr. Herriton'], ['Mr. Herriton']]]"
Q508,La prego-piano-piano-c e un  altra signorina che dorme--,['La prego-piano-piano-c e un  altra signorina che dorme--'],"[[151692, 151748]]",The Landlady,"['Harriet', 'Mr. Herriton']",Implicit,,[[]],[[]],[[]]
Q509,"We shall probably be arrested for brawling, Harriet. Have you the very
slightest sense of the ludicrous?","['We shall probably be arrested for brawling, Harriet. Have you the very\nslightest sense of the ludicrous?']","[[151752, 151856]]",Mr. Herriton,['Harriet'],Implicit,,"[['We', 'Harriet', 'you']]","[[[151752, 151754], [151796, 151803], [151810, 151813]]]","[[['Harriet', 'Mr. Herriton'], ['Harriet'], ['Harriet']]]"
Q510,"You, Caroline, here of all people!","['You, Caroline, here of all people!']","[[152720, 152754]]",Harriet,"['Caroline Abbott', 'Mr. Herriton']",Implicit,,"[['You', 'Caroline']]","[[[152720, 152723], [152725, 152733]]]","[[['Caroline Abbott'], ['Caroline Abbott']]]"
Q511,"You will have a lot to tell Miss Abbott,
Harriet, and she may have as much to tell you. So I ll pay my call on
Signor Carella, as you suggested, and see how things stand.","['You will have a lot to tell Miss Abbott,\nHarriet, and she may have as much to tell you. So I ll pay my call on\nSignor Carella, as you suggested, and see how things stand.']","[[152887, 153057]]",Mr. Herriton,"['Harriet', 'Caroline Abbott']",Implicit,,"[['You', 'Miss Abbott', 'Harriet', 'she', 'you', 'Signor Carella', 'you']]","[[[152887, 152890], [152915, 152926], [152928, 152935], [152941, 152944], [152970, 152973], [152998, 153012], [153017, 153020]]]","[[['Harriet'], ['Caroline Abbott'], ['Harriet'], ['Caroline Abbott'], ['Harriet'], ['Signor Carella'], ['Harriet']]]"
Q512,"Tear each other s eyes out! Give it to her, Harriet! Teach her to leave us alone. Give
it to her, Caroline! Teach her to be grateful to you. Go it, ladies; go
it!","['Tear each other s eyes out!', 'Give it to her, Harriet! Teach her to leave us alone. Give\nit to her, Caroline! Teach her to be grateful to you. Go it, ladies; go\nit!']","[[153225, 153252], [153307, 153441]]",Mr. Herriton,"['Harriet', 'Caroline Abbott']",Anaphoric,he cried,"[[], ['her', 'Harriet', 'her', 'us', 'Caroline']]","[[], [[153318, 153321], [153323, 153330], [153338, 153341], [153351, 153353], [153377, 153385]]]","[[], [['Caroline Abbott'], ['Harriet'], ['Caroline Abbott'], ['Harriet', 'Mr. Herriton'], ['Caroline Abbott']]]"
Q513,Where does Signor Carella live?,['Where does Signor Carella live?'],"[[154346, 154377]]",Mr. Herriton,['The Dogana Men'],Anaphoric,he asked the men at the Dogana,[['Signor Carella']],"[[[154357, 154371]]]",[[['Signor Carella']]]
Q514,"I ll show you,","['I ll show you,']","[[154413, 154427]]",Little Girl,"['Mr. Herriton', 'The Dogana Men']",Explicit,said a little girl,[['you']],"[[[154423, 154426]]]",[[['Mr. Herriton']]]
Q515,"She will show you, Follow
her always, always, and you will come to no harm. She is a trustworthy
guide. She is my

    daughter.""
     cousin.""
     sister.","['She will show you,', 'Follow\nher always, always, and you will come to no harm. She is a trustworthy\nguide. She is my\n\n    daughter.""\n     cousin.""\n     sister.']","[[154505, 154523], [154569, 154706]]",The Dogana Men,"['Little Girl', 'Mr. Herriton']",Explicit,said the Dogana men,"[['She', 'you'], ['her', 'you', 'She', 'She']]","[[[154505, 154508], [154519, 154522]], [[154576, 154579], [154600, 154603], [154626, 154629], [154654, 154657]]]","[[['Little Girl'], ['Mr. Herriton']], [['Little Girl'], ['Mr. Herriton'], ['Little Girl'], ['Little Girl']]]"
Q516,Do you chance to know whether Signor Carella is in?,['Do you chance to know whether Signor Carella is in?'],"[[154794, 154845]]",Mr. Herriton,"['Little Girl', 'The Dogana Men']",Anaphoric,he asked her,"[['you', 'Signor Carella']]","[[[154797, 154800], [154824, 154838]]]","[[['Little Girl'], ['Signor Carella']]]"
Q517,"That is Perfetta,","['That is Perfetta,']","[[155719, 155736]]",Little Girl,['Mr. Herriton'],Explicit,said the girl,[['Perfetta']],"[[[155727, 155735]]]",[[['Perfetta']]]
Q518,"I want to see Signor Carella,","['I want to see Signor Carella,']","[[155755, 155784]]",Mr. Herriton,"['Little Girl', 'Perfetta']",Explicit,cried Philip,[['Signor Carella']],"[[[155769, 155783]]]",[[['Signor Carella']]]
Q519,Out!,['Out!'],"[[155802, 155806]]",Perfetta,"['Little Girl', 'Mr. Herriton']",Implicit,,[[]],[[]],[[]]
Q520,"Out,","['Out,']","[[155810, 155814]]",Little Girl,"['Mr. Herriton', 'Perfetta']",Explicit,echoed the girl,[[]],[[]],[[]]
Q521,Why on earth did you say he was in?,['Why on earth did you say he was in?'],"[[155848, 155883]]",Mr. Herriton,['Little Girl'],Implicit,,"[['you', 'he']]","[[[155865, 155868], [155873, 155875]]]","[[['Little Girl'], ['Signor Carella']]]"
Q522,When will he be back?,['When will he be back?'],"[[156091, 156112]]",Mr. Herriton,"['Little Girl', 'Perfetta']",Anaphoric,he called to Perfetta,[['he']],"[[[156101, 156103]]]",[[['Signor Carella']]]
Q523,"I shall have to leave a message,","['I shall have to leave a message,']","[[156635, 156667]]",Mr. Herriton,"['Little Girl', 'Perfetta']",Anaphoric,he called,[[]],[[]],[[]]
Q524,"Now Perfetta has gone for her basket, When she
returns she will lower it--so. Then you will put your card into it. Then
she will raise it--thus. By this means--","['Now Perfetta has gone for her basket,', 'When she\nreturns she will lower it--so. Then you will put your card into it. Then\nshe will raise it--thus. By this means--']","[[156682, 156719], [156744, 156866]]",Little Girl,['Mr. Herriton'],Explicit,said the little girl,"[['Perfetta', 'her'], ['she', 'she', 'you', 'your', 'she']]","[[[156686, 156694], [156708, 156711]], [[156749, 156752], [156761, 156764], [156789, 156792], [156802, 156806], [156826, 156829]]]","[[['Perfetta'], ['Perfetta']], [['Perfetta'], ['Perfetta'], ['Mr. Herriton'], ['Mr. Herriton'], ['Perfetta']]]"
Q525,Beautiful as an angel! But who am I addressing?,"['Beautiful as an angel!', 'But who am I addressing?']","[[157479, 157501], [157573, 157597]]",Perfetta,"['Little Girl', 'Mr. Herriton']",Explicit,bellowed Perfetta,"[[], []]","[[], []]","[[], []]"
Q526,Thank you--here is my card.,['Thank you--here is my card.'],"[[157601, 157628]]",Mr. Herriton,"['Little Girl', 'Perfetta']",Implicit,,[['you']],"[[[157607, 157610]]]",[[['Perfetta']]]
Q527,"Has
a young lady happened to call here lately--a young English lady?",['Has\na young lady happened to call here lately--a young English lady?'],"[[157805, 157873]]",Mr. Herriton,"['Little Girl', 'Perfetta']",Implicit,,[[]],[[]],[[]]
Q528,"A young lady--pale, large, tall.","['A young lady--pale, large, tall.']","[[157929, 157961]]",Mr. Herriton,"['Little Girl', 'Perfetta']",Implicit,,[[]],[[]],[[]]
Q529,A YOUNG LADY!,['A YOUNG LADY!'],"[[157991, 158004]]",Mr. Herriton,"['Little Girl', 'Perfetta']",Implicit,,[[]],[[]],[[]]
Q530,"Perfetta is deaf when she chooses,","['Perfetta is deaf when she chooses,']","[[158008, 158042]]",Little Girl,['Mr. Herriton'],Anaphoric,said the Dogana s relative,"[['Perfetta', 'she']]","[[[158008, 158016], [158030, 158033]]]","[[['Perfetta'], ['Perfetta']]]"
Q531,"I was going to make myself some tea,","['I was going to make myself some tea,']","[[158753, 158789]]",Mr. Herriton,['Caroline Abbott'],Anaphoric,he said,[[]],[[]],[[]]
Q532,I should be grateful--,['I should be grateful--'],"[[158840, 158862]]",Caroline Abbott,['Mr. Herriton'],Implicit,,[[]],[[]],[[]]
Q533,"You see, Harriet knows nothing.","['You see,', 'Harriet knows nothing.']","[[158926, 158934], [158948, 158970]]",Caroline Abbott,['Mr. Herriton'],Anaphoric,she began,"[['You'], ['Harriet']]","[[[158926, 158929]], [[158948, 158955]]]","[[['Mr. Herriton']], [['Harriet']]]"
Q534,No more do I. He was out.,['No more do I. He was out.'],"[[158974, 158999]]",Mr. Herriton,['Caroline Abbott'],Implicit,,[['He']],"[[[158988, 158990]]]",[[['Signor Carella']]]
Q535,But what s that to do with it?,['But what s that to do with it?'],"[[159003, 159033]]",Caroline Abbott,['Mr. Herriton'],Implicit,,[[]],[[]],[[]]
Q536,"He was out. You find me as ignorant as you have left
Harriet.",['He was out. You find me as ignorant as you have left\nHarriet.'],"[[159123, 159184]]",Mr. Herriton,['Caroline Abbott'],Implicit,,"[['He', 'You', 'you', 'Harriet']]","[[[159123, 159125], [159135, 159138], [159162, 159165], [159176, 159183]]]","[[['Signor Carella'], ['Caroline Abbott'], ['Caroline Abbott'], ['Harriet']]]"
