quoteID,quoteText,subQuotationList,quoteByteSpans,speaker,addressees,quoteType,referringExpression,mentionTextsList,mentionSpansList,mentionEntitiesList
Q287,"After all she has suffered. That letter kept me awake for
nights. The whole thing is like one of those horrible modern plays where
no one is in  the right.  But if we have mourning, it will mean telling
Irma.","['After all she has suffered. That letter kept me awake for\nnights. The whole thing is like one of those horrible modern plays where\nno one is in  the right.  But if we have mourning, it will mean telling\nIrma.']","[[103913, 104121]]",Harriet,"['Mr. Herriton', 'Mrs. Herriton']",Implicit,,"[['she', 'we', 'Irma']]","[[[103923, 103926], [104077, 104079], [104116, 104120]]]","[[['Lilia'], ['Harriet', 'Mr. Herriton', 'Mrs. Herriton'], ['Irma']]]"
Q288,Of course we must tell Irma!,['Of course we must tell Irma!'],"[[104125, 104153]]",Mr. Herriton,"['Harriet', 'Mrs. Herriton']",Explicit,said Philip,"[['we', 'Irma']]","[[[104135, 104137], [104148, 104152]]]","[[['Harriet', 'Mr. Herriton', 'Mrs. Herriton'], ['Irma']]]"
Q289,"Of course, But I think we can still not tell her
about Lilia s marriage.","['Of course,', 'But I think we can still not tell her\nabout Lilia s marriage.']","[[104170, 104180], [104200, 104261]]",Mrs. Herriton,"['Harriet', 'Mr. Herriton']",Anaphoric,said his mother,"[[], ['we', 'her', 'Lilia']]","[[], [[104212, 104214], [104234, 104237], [104244, 104249]]]","[[], [['Harriet', 'Mr. Herriton', 'Mrs. Herriton'], ['Irma'], ['Lilia']]]"
Q290,I don t think that. And she must have suspected something by now.,['I don t think that. And she must have suspected something by now.'],"[[104265, 104330]]",Mr. Herriton,"['Harriet', 'Mrs. Herriton']",Implicit,,[['she']],"[[[104289, 104292]]]",[[['Irma']]]
Q291,"So one would have supposed. But she never cared for her mother, and
little girls of nine don t reason clearly. She looks on it as a long
visit. And it is important, most important, that she should not receive
a shock. All a child s life depends on the ideal it has of its parents.
Destroy that and everything goes--morals, behaviour, everything.
Absolute trust in some one else is the essence of education. That is why
I have been so careful about talking of poor Lilia before her.","['So one would have supposed. But she never cared for her mother, and\nlittle girls of nine don t reason clearly. She looks on it as a long\nvisit. And it is important, most important, that she should not receive\na shock. All a child s life depends on the ideal it has of its parents.\nDestroy that and everything goes--morals, behaviour, everything.\nAbsolute trust in some one else is the essence of education. That is why\nI have been so careful about talking of poor Lilia before her.']","[[104334, 104815]]",Mrs. Herriton,"['Harriet', 'Mr. Herriton']",Implicit,,"[['she', 'her mother', 'She', 'she', 'Lilia', 'her']]","[[[104366, 104369], [104386, 104396], [104445, 104448], [104520, 104523], [104798, 104803], [104811, 104814]]]","[[['Irma'], ['Lilia'], ['Irma'], ['Irma'], ['Lilia'], ['Irma']]]"
Q292,"But you forget this wretched baby. Waters and Adamson write that there
is a baby.",['But you forget this wretched baby. Waters and Adamson write that there\nis a baby.'],"[[104819, 104900]]",Mr. Herriton,"['Harriet', 'Mrs. Herriton']",Implicit,,[['you']],"[[[104823, 104826]]]",[[['Mrs. Herriton']]]
Q293,"Mrs. Theobald must be told. But she doesn t count. She is breaking
up very quickly. She doesn t even see Mr. Kingcroft now. He, thank
goodness, I hear, has at last consoled himself with someone else.","['Mrs. Theobald must be told. But she doesn t count. She is breaking\nup very quickly. She doesn t even see Mr. Kingcroft now. He, thank\ngoodness, I hear, has at last consoled himself with someone else.']","[[104904, 105103]]",Mrs. Herriton,"['Harriet', 'Mr. Herriton']",Implicit,,"[['Mrs. Theobald', 'she', 'She', 'She', 'Mr. Kingcroft', 'He', 'himself']]","[[[104904, 104917], [104936, 104939], [104955, 104958], [104988, 104991], [105009, 105022], [105028, 105030], [105077, 105084]]]","[[['Mrs. Theobald'], ['Mrs. Theobald'], ['Mrs. Theobald'], ['Mrs. Theobald'], ['Mr. Kingcroft'], ['Mr. Kingcroft'], ['Mr. Kingcroft']]]"
Q294,"The child must know some time,","['The child must know some time,']","[[105107, 105137]]",Mr. Herriton,"['Harriet', 'Mrs. Herriton']",Explicit,persisted Philip,[['The child']],"[[[105107, 105116]]]",[[['Irma']]]
Q295,The later the better. Every moment she is developing.,['The later the better. Every moment she is developing.'],"[[105225, 105278]]",Mrs. Herriton,"['Harriet', 'Mr. Herriton']",Implicit,,[['she']],"[[[105260, 105263]]]",[[['Irma']]]
Q296,"I must say it seems rather hard luck, doesn t it?","['I must say it seems rather hard luck, doesn t it?']","[[105282, 105331]]",Mr. Herriton,"['Harriet', 'Mrs. Herriton']",Implicit,,[[]],[[]],[[]]
Q297,On Irma? Why?,['On Irma? Why?'],"[[105335, 105348]]",Mrs. Herriton,"['Harriet', 'Mr. Herriton']",Implicit,,[['Irma']],"[[[105338, 105342]]]",[[['Irma']]]
Q298,"On us, perhaps. We have morals and behaviour also, and I don t think
this continual secrecy improves them.","['On us, perhaps. We have morals and behaviour also, and I don t think\nthis continual secrecy improves them.']","[[105352, 105458]]",Mr. Herriton,"['Harriet', 'Mrs. Herriton']",Implicit,,"[['us', 'We']]","[[[105355, 105357], [105368, 105370]]]","[[['Harriet', 'Mr. Herriton', 'Mrs. Herriton'], ['Harriet', 'Mr. Herriton', 'Mrs. Herriton']]]"
Q299,"There s no need to twist the thing round to that,","['There s no need to twist the thing round to that,']","[[105462, 105511]]",Harriet,"['Mr. Herriton', 'Mrs. Herriton']",Explicit,said Harriet,[[]],[[]],[[]]
Q300,"Of course there isn t, Let s keep to the main issue.
This baby s quite beside the point. Mrs. Theobald will do nothing, and
it s no concern of ours.","['Of course there isn t,', 'Let s keep to the main issue.\nThis baby s quite beside the point. Mrs. Theobald will do nothing, and\nit s no concern of ours.']","[[105547, 105569], [105589, 105714]]",Mrs. Herriton,"['Harriet', 'Mr. Herriton']",Anaphoric,said her mother,"[[], ['Mrs. Theobald']]","[[], [[105655, 105668]]]","[[], [['Mrs. Theobald']]]"
Q301,"It will make a difference in the money, surely,","['It will make a difference in the money, surely,']","[[105718, 105765]]",Mr. Herriton,"['Harriet', 'Mrs. Herriton']",Anaphoric,said he,[[]],[[]],[[]]
Q302,"No, dear; very little. Poor Charles provided for every kind of
contingency in his will. The money will come to you and Harriet, as
Irma s guardians.","['No, dear; very little. Poor Charles provided for every kind of\ncontingency in his will. The money will come to you and Harriet, as\nIrma s guardians.']","[[105778, 105926]]",Mrs. Herriton,"['Harriet', 'Mr. Herriton']",Implicit,,"[['you', 'Harriet', 'Irma']]","[[[105889, 105892], [105897, 105904], [105909, 105913]]]","[[['Mr. Herriton'], ['Harriet'], ['Irma']]]"
Q303,Good. Does the Italian get anything?,['Good. Does the Italian get anything?'],"[[105930, 105966]]",Mr. Herriton,"['Harriet', 'Mrs. Herriton']",Implicit,,[[]],[[]],[[]]
Q304,He will get all hers. But you know what that is.,['He will get all hers. But you know what that is.'],"[[105970, 106018]]",Mrs. Herriton,"['Harriet', 'Mr. Herriton']",Implicit,,"[['He', 'you']]","[[[105970, 105972], [105996, 105999]]]","[[['Signor Carella'], ['Mr. Herriton']]]"
Q305,"Good. So those are our tactics--to tell no one about the baby, not even
Miss Abbott.","['Good. So those are our tactics--to tell no one about the baby, not even\nMiss Abbott.']","[[106022, 106106]]",Mr. Herriton,"['Harriet', 'Mrs. Herriton']",Implicit,,[['Miss Abbott']],"[[[106094, 106105]]]",[[['Caroline Abbott']]]
Q306,"Most certainly this is the proper course, And why ever
should we tell Caroline?","['Most certainly this is the proper course,', 'And why ever\nshould we tell Caroline?']","[[106110, 106151], [106227, 106264]]",Mrs. Herriton,"['Harriet', 'Mr. Herriton']",Explicit,said Mrs Herriton,"[[], ['we', 'Caroline']]","[[], [[106247, 106249], [106255, 106263]]]","[[], [['Harriet', 'Mr. Herriton', 'Mrs. Herriton'], ['Caroline Abbott']]]"
Q307,She was so mixed up in the affair.,['She was so mixed up in the affair.'],"[[106268, 106302]]",Mr. Herriton,"['Harriet', 'Mrs. Herriton']",Implicit,,[['She']],"[[[106268, 106271]]]",[[['Caroline Abbott']]]
Q308,"Poor silly creature. The less she hears about it the better she will be
pleased. I have come to be very sorry for Caroline. She, if any one,
has suffered and been penitent. She burst into tears when I told her a
little, only a little, of that terrible letter. I never saw such genuine
remorse. We must forgive her and forget. Let the dead bury their dead.
We will not trouble her with them.","['Poor silly creature. The less she hears about it the better she will be\npleased. I have come to be very sorry for Caroline. She, if any one,\nhas suffered and been penitent. She burst into tears when I told her a\nlittle, only a little, of that terrible letter. I never saw such genuine\nremorse. We must forgive her and forget. Let the dead bury their dead.\nWe will not trouble her with them.']","[[106306, 106696]]",Mrs. Herriton,"['Harriet', 'Mr. Herriton']",Implicit,,"[['she', 'she', 'Caroline', 'She', 'She', 'her', 'We', 'her', 'We', 'her']]","[[[106336, 106339], [106366, 106369], [106420, 106428], [106430, 106433], [106479, 106482], [106512, 106515], [106600, 106602], [106616, 106619], [106662, 106664], [106682, 106685]]]","[[['Caroline Abbott'], ['Caroline Abbott'], ['Caroline Abbott'], ['Caroline Abbott'], ['Caroline Abbott'], ['Caroline Abbott'], ['Harriet', 'Mr. Herriton', 'Mrs. Herriton'], ['Caroline Abbott'], ['Harriet', 'Mr. Herriton', 'Mrs. Herriton'], ['Caroline Abbott']]]"
Q309,"Here beginneth the New Life, then. Do you
remember, mother, that was what we said when we saw Lilia off?","['Here beginneth the New Life, then. Do you\nremember, mother, that was what we said when we saw Lilia off?']","[[106790, 106894]]",Mr. Herriton,"['Harriet', 'Mrs. Herriton']",Implicit,,"[['you', 'we', 'we', 'Lilia']]","[[[106828, 106831], [106864, 106866], [106877, 106879], [106884, 106889]]]","[[['Mrs. Herriton'], ['Harriet', 'Mr. Herriton', 'Mrs. Herriton'], ['Harriet', 'Mr. Herriton', 'Mrs. Herriton'], ['Lilia']]]"
Q310,"Yes, dear; but now it is really a New Life, because we are all at
accord. Then you were still infatuated with Italy. It may be full
of beautiful pictures and churches, but we cannot judge a country by
anything but its men.","['Yes, dear; but now it is really a New Life, because we are all at\naccord. Then you were still infatuated with Italy. It may be full\nof beautiful pictures and churches, but we cannot judge a country by\nanything but its men.']","[[106898, 107120]]",Mrs. Herriton,"['Harriet', 'Mr. Herriton']",Implicit,,"[['we', 'you', 'we']]","[[[106950, 106952], [106977, 106980], [107070, 107072]]]","[[['Harriet', 'Mr. Herriton', 'Mrs. Herriton'], ['Mr. Herriton'], ['Mr. Herriton']]]"
Q311,"That is quite true,","['That is quite true,']","[[107124, 107143]]",Mr. Herriton,"['Harriet', 'Mrs. Herriton']",Anaphoric,he said,[[]],[[]],[[]]
Q312,"As for Caroline, I was almost frightened. She
broke down utterly. She cried even when she left the house. I comforted
her as best I could, and I kissed her. It is something that the breach
between her and ourselves is now entirely healed.","['As for Caroline,', 'I was almost frightened. She\nbroke down utterly. She cried even when she left the house. I comforted\nher as best I could, and I kissed her. It is something that the breach\nbetween her and ourselves is now entirely healed.']","[[107770, 107786], [107809, 108030]]",Mrs. Herriton,['Mr. Herriton'],Explicit,said Mrs Herriton,"[['Caroline'], ['She', 'She', 'she', 'her', 'her', 'her']]","[[[107777, 107785]], [[107834, 107837], [107858, 107861], [107878, 107881], [107910, 107913], [107944, 107947], [107989, 107992]]]","[[['Caroline Abbott']], [['Caroline Abbott'], ['Caroline Abbott'], ['Caroline Abbott'], ['Caroline Abbott'], ['Caroline Abbott'], ['Caroline Abbott']]]"
Q313,"Did she ask no questions--as to the nature of Lilia s death, I mean?","['Did she ask no questions--as to the nature of Lilia s death, I mean?']","[[108034, 108102]]",Mr. Herriton,['Mrs. Herriton'],Implicit,,"[['she', 'Lilia']]","[[[108038, 108041], [108080, 108085]]]","[[['Caroline Abbott'], ['Lilia']]]"
Q314,"She did. But she has a mind of extraordinary delicacy. She saw that I
was reticent, and she did not press me. You see, Philip, I can say to
you what I could not say before Harriet. Her ideas are so crude. Really
we do not want it known in Sawston that there is a baby. All peace and
comfort would be lost if people came inquiring after it.","['She did. But she has a mind of extraordinary delicacy. She saw that I\nwas reticent, and she did not press me. You see, Philip, I can say to\nyou what I could not say before Harriet. Her ideas are so crude. Really\nwe do not want it known in Sawston that there is a baby. All peace and\ncomfort would be lost if people came inquiring after it.']","[[108106, 108445]]",Mrs. Herriton,['Mr. Herriton'],Implicit,,"[['She', 'she', 'She', 'she', 'You', 'Philip', 'you', 'Harriet', 'Her', 'we']]","[[[108106, 108109], [108119, 108122], [108161, 108164], [108194, 108197], [108216, 108219], [108225, 108231], [108246, 108249], [108278, 108285], [108287, 108290], [108318, 108320]]]","[[['Caroline Abbott'], ['Caroline Abbott'], ['Caroline Abbott'], ['Caroline Abbott'], ['Mr. Herriton'], ['Mr. Herriton'], ['Mr. Herriton'], ['Harriet'], ['Harriet'], ['Mr. Herriton', 'Mrs. Herriton']]]"
Q315,"It
is all so strange as well as so tragic. And what I did was as strange as
anything.",['It\nis all so strange as well as so tragic. And what I did was as strange as\nanything.'],"[[109310, 109395]]",Caroline Abbott,['Mr. Herriton'],Anaphoric,she broke the thread of vague commiseration and said,[[]],[[]],[[]]
Q316,"Never mind, It s all over now. Let the dead bury
their dead. It s fallen out of our lives.","['Never mind,', 'It s all over now. Let the dead bury\ntheir dead. It s fallen out of our lives.']","[[109475, 109486], [109498, 109576]]",Mr. Herriton,['Caroline Abbott'],Anaphoric,he said,"[[], []]","[[], []]","[[], []]"
Q317,"But that s why I can talk about it and tell you everything I have
always wanted to. You thought me stupid and sentimental and wicked and
mad, but you never really knew how much I was to blame.","['But that s why I can talk about it and tell you everything I have\nalways wanted to. You thought me stupid and sentimental and wicked and\nmad, but you never really knew how much I was to blame.']","[[109580, 109772]]",Caroline Abbott,['Mr. Herriton'],Implicit,,"[['you', 'You', 'you']]","[[[109624, 109627], [109664, 109667], [109726, 109729]]]","[[['Mr. Herriton'], ['Mr. Herriton'], ['Mr. Herriton']]]"
Q318,"Indeed I never think about it now,","['Indeed I never think about it now,']","[[109776, 109810]]",Mr. Herriton,['Caroline Abbott'],Explicit,said Philip,[[]],[[]],[[]]
Q319,"The first evening we got to Monteriano, Lilia went out
for a walk alone, saw that Italian in a picturesque position on a wall,
and fell in love. He was shabbily dressed, and she did not even know
he was the son of a dentist. I must tell you I was used to this sort
of thing. Once or twice before I had had to send people about their
business.","['The first evening we got to Monteriano,', 'Lilia went out\nfor a walk alone, saw that Italian in a picturesque position on a wall,\nand fell in love. He was shabbily dressed, and she did not even know\nhe was the son of a dentist. I must tell you I was used to this sort\nof thing. Once or twice before I had had to send people about their\nbusiness.']","[[109947, 109986], [110004, 110306]]",Caroline Abbott,['Mr. Herriton'],Anaphoric,she persisted,"[['we'], ['Lilia', 'He', 'she', 'he', 'you']]","[[[109965, 109967]], [[110004, 110009], [110109, 110111], [110138, 110141], [110160, 110162], [110201, 110204]]]","[[['Caroline Abbott', 'Lilia']], [['Lilia'], ['Signor Carella'], ['Lilia'], ['Signor Carella'], ['Mr. Herriton']]]"
Q320,"Yes; we counted on you,","['Yes; we counted on you,']","[[110310, 110333]]",Mr. Herriton,['Caroline Abbott'],Explicit,said Philip,"[['we', 'you']]","[[[110315, 110317], [110329, 110332]]]","[[['Harriet', 'Mr. Herriton', 'Mrs. Herriton'], ['Caroline Abbott']]]"
Q321,"I know you did, Lilia saw him
several times again, and I knew I ought to interfere. I called her to
my bedroom one night. She was very frightened, for she knew what it was
about and how severe I could be.  Do you love this man?  I asked.  Yes
or no?  She said  Yes.  And I said,  Why don t you marry him if you
think you ll be happy?","['I know you did,', 'Lilia saw him\nseveral times again, and I knew I ought to interfere. I called her to\nmy bedroom one night. She was very frightened, for she knew what it was\nabout and how severe I could be.  Do you love this man?  I asked.  Yes\nor no?  She said  Yes.  And I said,  Why don t you marry him if you\nthink you ll be happy?']","[[110450, 110465], [110503, 110821]]",Caroline Abbott,['Mr. Herriton'],Anaphoric,she retorted,"[['you'], ['Lilia', 'him', 'her', 'She', 'she', 'you', 'She', 'you', 'him', 'you', 'you']]","[[[110457, 110460]], [[110503, 110508], [110513, 110516], [110580, 110583], [110609, 110612], [110638, 110641], [110696, 110699], [110738, 110741], [110777, 110780], [110787, 110790], [110794, 110797], [110804, 110807]]]","[[['Mr. Herriton']], [['Lilia'], ['Signor Carella'], ['Lilia'], ['Lilia'], ['Lilia'], ['Lilia'], ['Lilia'], ['Lilia'], ['Signor Carella'], ['Lilia'], ['Lilia']]]"
Q322,"Really--really, You knew Lilia all your life. Apart from everything
else--as if she could choose what could make her happy!","['Really--really,', 'You knew Lilia all your life. Apart from everything\nelse--as if she could choose what could make her happy!']","[[110825, 110840], [110915, 111022]]",Mr. Herriton,['Caroline Abbott'],Explicit,exploded Philip,"[[], ['You', 'Lilia', 'your', 'she', 'her']]","[[], [[110915, 110918], [110924, 110929], [110934, 110938], [110979, 110982], [111012, 111015]]]","[[], [['Caroline Abbott'], ['Lilia'], ['Caroline Abbott'], ['Lilia'], ['Lilia']]]"
Q323,Had you ever let her choose?,['Had you ever let her choose?'],"[[111026, 111054]]",Caroline Abbott,['Mr. Herriton'],Anaphoric,she flashed out,"[['you', 'her']]","[[[111030, 111033], [111043, 111046]]]","[[['Mr. Herriton'], ['Lilia']]]"
Q324,"I m afraid that s
rude,","['I m afraid that s\nrude,']","[[111074, 111097]]",Caroline Abbott,['Mr. Herriton'],Anaphoric,she added,[[]],[[]],[[]]
Q325,"Let us rather say unhappily expressed,","['Let us rather say unhappily expressed,']","[[111136, 111174]]",Mr. Herriton,['Caroline Abbott'],Explicit,said Philip,[['us']],"[[[111140, 111142]]]","[[['Caroline Abbott', 'Mr. Herriton']]]"
Q326,"I want to finish. Next morning I found Signor Carella and said the same
to him. He--well, he was willing. That s all.","['I want to finish. Next morning I found Signor Carella and said the same\nto him. He--well, he was willing. That s all.']","[[111254, 111371]]",Caroline Abbott,['Mr. Herriton'],Implicit,,"[['Signor Carella', 'him', 'He', 'he']]","[[[111293, 111307], [111329, 111332], [111334, 111336], [111344, 111346]]]","[[['Signor Carella'], ['Signor Carella'], ['Signor Carella'], ['Signor Carella']]]"
Q327,And the telegram?,['And the telegram?'],"[[111375, 111392]]",Mr. Herriton,['Caroline Abbott'],Implicit,,[[]],[[]],[[]]
Q328,"Ah, the telegram! That was
wrong. Lilia there was more cowardly than I was. We should have told the
truth. It lost me my nerve, at all events. I came to the station meaning
to tell you everything then. But we had started with a lie, and I got
frightened. And at the end, when you left, I got frightened again and
came with you.","['Ah, the telegram! That was\nwrong. Lilia there was more cowardly than I was. We should have told the\ntruth. It lost me my nerve, at all events. I came to the station meaning\nto tell you everything then. But we had started with a lie, and I got\nfrightened. And at the end, when you left, I got frightened again and\ncame with you.']","[[111553, 111880]]",Caroline Abbott,['Mr. Herriton'],Implicit,,"[['Lilia', 'We', 'you', 'we', 'you', 'you']]","[[[111587, 111592], [111629, 111631], [111734, 111737], [111759, 111761], [111829, 111832], [111876, 111879]]]","[[['Lilia'], ['Caroline Abbott', 'Lilia'], ['Mr. Herriton'], ['Caroline Abbott', 'Lilia'], ['Mr. Herriton'], ['Mr. Herriton']]]"
Q329,Did you really mean to stop?,['Did you really mean to stop?'],"[[111884, 111912]]",Mr. Herriton,['Caroline Abbott'],Implicit,,[['you']],"[[[111888, 111891]]]",[[['Caroline Abbott']]]
Q330,"For a time, at all events.","['For a time, at all events.']","[[111916, 111942]]",Caroline Abbott,['Mr. Herriton'],Implicit,,[[]],[[]],[[]]
Q331,Would that have suited a newly married pair?,['Would that have suited a newly married pair?'],"[[111946, 111990]]",Mr. Herriton,['Caroline Abbott'],Implicit,,[[]],[[]],[[]]
Q332,"It would have suited them. Lilia needed me. And as for him--I can t
help feeling I might have got influence over him.",['It would have suited them. Lilia needed me. And as for him--I can t\nhelp feeling I might have got influence over him.'],"[[111994, 112111]]",Caroline Abbott,['Mr. Herriton'],Implicit,,"[['them', 'Lilia', 'him', 'him']]","[[[112015, 112019], [112021, 112026], [112049, 112052], [112107, 112110]]]","[[['Signor Carella', 'Lilia'], ['Lilia'], ['Signor Carella'], ['Signor Carella']]]"
Q333,"I am ignorant of these matters, but I should have
thought that would have increased the difficulty of the situation.","['I am ignorant of these matters,', 'but I should have\nthought that would have increased the difficulty of the situation.']","[[112115, 112146], [112162, 112246]]",Mr. Herriton,['Caroline Abbott'],Explicit,said Philip,"[[], []]","[[], []]","[[], []]"
Q334,"Well, I have explained.","['Well, I have explained.']","[[112349, 112372]]",Caroline Abbott,['Mr. Herriton'],Anaphoric,She looked hopelessly at the raw overbuilt country and said,[[]],[[]],[[]]
Q335,"But pardon me, Miss Abbott; of most of your conduct you have given a
description rather than an explanation.","['But pardon me, Miss Abbott; of most of your conduct you have given a\ndescription rather than an explanation.']","[[112376, 112484]]",Mr. Herriton,['Caroline Abbott'],Implicit,,"[['Miss Abbott', 'your', 'you']]","[[[112391, 112402], [112415, 112419], [112428, 112431]]]","[[['Caroline Abbott'], ['Caroline Abbott'], ['Caroline Abbott']]]"
Q336,"An explanation may bore
you, Mr. Herriton: it drags in other topics.","['An explanation may bore\nyou, Mr. Herriton: it drags in other topics.']","[[112608, 112676]]",Caroline Abbott,['Mr. Herriton'],Anaphoric,she answered,"[['you', 'Mr. Herriton']]","[[[112632, 112635], [112637, 112649]]]","[[['Mr. Herriton'], ['Mr. Herriton']]]"
Q337,"Oh, never mind.","['Oh, never mind.']","[[112680, 112695]]",Mr. Herriton,['Caroline Abbott'],Implicit,,[[]],[[]],[[]]
Q338,"I hated Sawston, you see.","['I hated Sawston, you see.']","[[112699, 112724]]",Caroline Abbott,['Mr. Herriton'],Implicit,,[['you']],"[[[112716, 112719]]]",[[['Mr. Herriton']]]
Q339,So did and do I. That s splendid. Go on.,['So did and do I. That s splendid. Go on.'],"[[112746, 112786]]",Mr. Herriton,['Caroline Abbott'],Implicit,,[[]],[[]],[[]]
Q340,"I hated the idleness, the stupidity, the respectability, the petty
unselfishness.","['I hated the idleness, the stupidity, the respectability, the petty\nunselfishness.']","[[112790, 112871]]",Caroline Abbott,['Mr. Herriton'],Implicit,,[[]],[[]],[[]]
Q341,"Petty selfishness,","['Petty selfishness,']","[[112875, 112893]]",Mr. Herriton,['Caroline Abbott'],Anaphoric,he corrected,[[]],[[]],[[]]
Q342,"Petty unselfishness, I had got an idea that every one
here spent their lives in making little sacrifices for objects they
didn t care for, to please people they didn t love; that they never
learnt to be sincere--and, what s as bad, never learnt how to enjoy
themselves. That s what I thought--what I thought at Monteriano.","['Petty unselfishness,', 'I had got an idea that every one\nhere spent their lives in making little sacrifices for objects they\ndidn t care for, to please people they didn t love; that they never\nlearnt to be sincere--and, what s as bad, never learnt how to enjoy\nthemselves. That s what I thought--what I thought at Monteriano.']","[[112959, 112979], [112996, 113297]]",Caroline Abbott,['Mr. Herriton'],Anaphoric,she repeated,"[[], []]","[[], []]","[[], []]"
Q343,"Why, Miss Abbott, you should have told me this before!
Think it still! I agree with lots of it. Magnificent!","['Why, Miss Abbott,', 'you should have told me this before!\nThink it still! I agree with lots of it. Magnificent!']","[[113301, 113318], [113331, 113421]]",Mr. Herriton,['Caroline Abbott'],Anaphoric,he cried,"[['Miss Abbott'], ['you']]","[[[113306, 113317]], [[113331, 113334]]]","[[['Caroline Abbott']], [['Caroline Abbott']]]"
