quoteID,quoteText,subQuotationList,quoteByteSpans,speaker,addressees,quoteType,referringExpression,mentionTextsList,mentionSpansList,mentionEntitiesList
Q665,"When my poor wife died I thought of having my relatives to live here.
My father wished to give up his practice at Empoli; my mother and
sisters and two aunts were also willing. But it was impossible. They
have their ways of doing things, and when I was younger I was content
with them. But now I am a man. I have my own ways. Do you understand?","['When my poor wife died I thought of having my relatives to live here.\nMy father wished to give up his practice at Empoli; my mother and\nsisters and two aunts were also willing. But it was impossible. They\nhave their ways of doing things, and when I was younger I was content\nwith them. But now I am a man. I have my own ways. Do you understand?']","[[197562, 197906]]",Signor Carella,['Caroline Abbott'],Implicit,,[['you']],"[[[197891, 197894]]]",[[['Caroline Abbott']]]
Q666,"Yes, I do,","['Yes, I do,']","[[197910, 197920]]",Caroline Abbott,['Signor Carella'],Explicit,said Miss Abbott,[[]],[[]],[[]]
Q667,"It is a large house,","['It is a large house,']","[[198266, 198286]]",Caroline Abbott,['Signor Carella'],Anaphoric,she repeated,[[]],[[]],[[]]
Q668,"Immense; and the taxes! But it will be better when--Ah! but you have
never guessed why I went to Poggibonsi--why it was that I was out when
he called.",['Immense; and the taxes! But it will be better when--Ah! but you have\nnever guessed why I went to Poggibonsi--why it was that I was out when\nhe called.'],"[[198304, 198454]]",Signor Carella,['Caroline Abbott'],Implicit,,"[['you', 'he']]","[[[198364, 198367], [198444, 198446]]]","[[['Caroline Abbott'], ['Mr. Herriton']]]"
Q669,"I cannot guess, Signor Carella. I am here on business.","['I cannot guess, Signor Carella. I am here on business.']","[[198458, 198512]]",Caroline Abbott,['Signor Carella'],Implicit,,[['Signor Carella']],"[[[198474, 198488]]]",[[['Signor Carella']]]
Q670,But try.,['But try.'],"[[198516, 198524]]",Signor Carella,['Caroline Abbott'],Implicit,,[[]],[[]],[[]]
Q671,I cannot; I hardly know you.,['I cannot; I hardly know you.'],"[[198528, 198556]]",Caroline Abbott,['Signor Carella'],Implicit,,[['you']],"[[[198552, 198555]]]",[[['Signor Carella']]]
Q672,"But we are old friends, and your approval will be grateful
to me. You gave it me once before. Will you give it now?","['But we are old friends,', 'and your approval will be grateful\nto me. You gave it me once before. Will you give it now?']","[[198560, 198583], [198595, 198686]]",Signor Carella,['Caroline Abbott'],Anaphoric,he said,"[['we'], ['your', 'You', 'you']]","[[[198564, 198566]], [[198599, 198603], [198637, 198640], [198670, 198673]]]","[[['Signor Carella', 'Caroline Abbott']], [['Caroline Abbott'], ['Caroline Abbott'], ['Caroline Abbott']]]"
Q673,"I have not come as a friend this time, I am not
likely, Signor Carella, to approve of anything you do.","['I have not come as a friend this time,', 'I am not\nlikely, Signor Carella, to approve of anything you do.']","[[198690, 198728], [198753, 198816]]",Caroline Abbott,['Signor Carella'],Anaphoric,she answered,"[[], ['Signor Carella', 'you']]","[[], [[198770, 198784], [198809, 198812]]]","[[], [['Signor Carella'], ['Signor Carella']]]"
Q674,"Oh, Signorina!","['Oh, Signorina!']","[[198820, 198834]]",Signor Carella,['Caroline Abbott'],Implicit,,[[]],[[]],[[]]
Q675,Surely you approve of marriage?,['Surely you approve of marriage?'],"[[198889, 198920]]",Signor Carella,['Caroline Abbott'],Implicit,,[['you']],"[[[198896, 198899]]]",[[['Caroline Abbott']]]
Q676,"Where there is love,","['Where there is love,']","[[198924, 198944]]",Caroline Abbott,['Signor Carella'],Explicit,said Miss Abbott,[[]],[[]],[[]]
Q677,"Where there is love,","['Where there is love,']","[[199069, 199089]]",Signor Carella,['Caroline Abbott'],Anaphoric,said he,[[]],[[]],[[]]
Q678,Do I understand that you are proposing to marry again?,['Do I understand that you are proposing to marry again?'],"[[199187, 199241]]",Caroline Abbott,['Signor Carella'],Implicit,,[['you']],"[[[199208, 199211]]]",[[['Signor Carella']]]
Q679,"I forbid you, then!","['I forbid you, then!']","[[199257, 199276]]",Caroline Abbott,['Signor Carella'],Implicit,,[['you']],"[[[199266, 199269]]]",[[['Signor Carella']]]
Q680,I forbid you!,['I forbid you!'],"[[199350, 199363]]",Caroline Abbott,['Signor Carella'],Explicit,repeated Miss Abbott,[['you']],"[[[199359, 199362]]]",[[['Signor Carella']]]
Q681,But why?,['But why?'],"[[199478, 199486]]",Signor Carella,['Caroline Abbott'],Implicit,,[[]],[[]],[[]]
Q682,"You have ruined one woman; I forbid you to ruin another. It is not a
year since Lilia died. You pretended to me the other day that you loved
her. It is a lie. You wanted her money. Has this woman money too?",['You have ruined one woman; I forbid you to ruin another. It is not a\nyear since Lilia died. You pretended to me the other day that you loved\nher. It is a lie. You wanted her money. Has this woman money too?'],"[[199604, 199810]]",Caroline Abbott,['Signor Carella'],Implicit,,"[['You', 'you', 'Lilia', 'You', 'you', 'her', 'You', 'her']]","[[[199604, 199607], [199640, 199643], [199684, 199689], [199696, 199699], [199735, 199738], [199745, 199748], [199763, 199766], [199774, 199777]]]","[[['Signor Carella'], ['Signor Carella'], ['Lilia'], ['Signor Carella'], ['Signor Carella'], ['Lilia'], ['Signor Carella'], ['Lilia']]]"
Q683,"Why, yes! A little.","['Why, yes!', 'A little.']","[[199814, 199823], [199845, 199854]]",Signor Carella,['Caroline Abbott'],Anaphoric,he said,"[[], []]","[[], []]","[[], []]"
Q684,And I suppose you will say that you love her.,['And I suppose you will say that you love her.'],"[[199858, 199903]]",Caroline Abbott,['Signor Carella'],Implicit,,"[['you', 'you']]","[[[199872, 199875], [199890, 199893]]]","[[['Signor Carella'], ['Signor Carella']]]"
Q685,I shall not say it. It will be untrue. Now my poor wife--,['I shall not say it. It will be untrue. Now my poor wife--'],"[[199907, 199964]]",Signor Carella,['Caroline Abbott'],Implicit,,[[]],[[]],[[]]
Q686,So you do not advise me? But why should it be a failure?,"['So you do not advise me?', 'But why should it be a failure?']","[[200579, 200603], [200626, 200657]]",Signor Carella,['Caroline Abbott'],Anaphoric,he said,"[['you'], []]","[[[200582, 200585]], []]","[[['Caroline Abbott']], []]"
Q687,"How can it
succeed, where there is no love?","['How can it\nsucceed,', 'where there is no love?']","[[200791, 200810], [200832, 200855]]",Caroline Abbott,['Signor Carella'],Anaphoric,she said,"[[], []]","[[], []]","[[], []]"
Q688,But she does love me! I forgot to tell you that.,['But she does love me! I forgot to tell you that.'],"[[200859, 200907]]",Signor Carella,['Caroline Abbott'],Implicit,,[['you']],"[[[200898, 200901]]]",[[['Caroline Abbott']]]
Q689,Indeed.,['Indeed.'],"[[200911, 200918]]",Caroline Abbott,['Signor Carella'],Implicit,,[[]],[[]],[[]]
Q690,Passionately.,['Passionately.'],"[[200922, 200935]]",Signor Carella,['Caroline Abbott'],Implicit,,[[]],[[]],[[]]
Q691,Then God help her!,['Then God help her!'],"[[200976, 200994]]",Caroline Abbott,['Signor Carella'],Implicit,,[[]],[[]],[[]]
Q692,"Whatever I say displeases you, Signorina. God
help you, for you are most unfair. You say that I ill-treated my dear
wife. It is not so. I have never ill-treated any one. You complain that
there is no love in this marriage. I prove that there is, and you become
still more angry. What do you want? Do you suppose she will not be
contented? Glad enough she is to get me, and she will do her duty well.","['Whatever I say displeases you, Signorina. God\nhelp you, for you are most unfair. You say that I ill-treated my dear\nwife. It is not so. I have never ill-treated any one. You complain that\nthere is no love in this marriage. I prove that there is, and you become\nstill more angry. What do you want? Do you suppose she will not be\ncontented? Glad enough she is to get me, and she will do her duty well.']","[[201022, 201421]]",Signor Carella,['Caroline Abbott'],Implicit,,"[['you', 'you', 'you', 'You', 'You', 'you', 'you', 'you']]","[[[201048, 201051], [201073, 201076], [201082, 201085], [201103, 201106], [201192, 201195], [201272, 201275], [201309, 201312], [201322, 201325]]]","[[['Caroline Abbott'], ['Caroline Abbott'], ['Caroline Abbott'], ['Caroline Abbott'], ['Caroline Abbott'], ['Caroline Abbott'], ['Caroline Abbott'], ['Caroline Abbott']]]"
Q693,Her duty!,['Her duty!'],"[[201425, 201434]]",Caroline Abbott,['Signor Carella'],Explicit,cried Miss Abbott,[[]],[[]],[[]]
Q694,"Why, of course. She knows why I am marrying her.","['Why, of course. She knows why I am marrying her.']","[[201507, 201555]]",Signor Carella,['Caroline Abbott'],Implicit,,[[]],[[]],[[]]
Q695,"To succeed where Lilia failed! To be your housekeeper, your slave,
you--","['To succeed where Lilia failed! To be your housekeeper, your slave,\nyou--']","[[201559, 201631]]",Caroline Abbott,['Signor Carella'],Implicit,,"[['Lilia', 'your', 'your', 'you']]","[[[201576, 201581], [201596, 201600], [201614, 201618], [201626, 201629]]]","[[['Lilia'], ['Signor Carella'], ['Signor Carella'], ['Signor Carella']]]"
Q696,"To look after the baby, certainly,","['To look after the baby, certainly,']","[[201699, 201733]]",Signor Carella,['Caroline Abbott'],Anaphoric,said he,[[]],[[]],[[]]
Q697,The baby--?,['The baby--?'],"[[201746, 201757]]",Caroline Abbott,['Signor Carella'],Implicit,,[[]],[[]],[[]]
Q698,"It is an English marriage, I do not care about the
money. I am having her for my son. Did you not understand that?","['It is an English marriage,', 'I do not care about the\nmoney. I am having her for my son. Did you not understand that?']","[[201783, 201809], [201829, 201916]]",Signor Carella,['Caroline Abbott'],Anaphoric,he said,"[[], ['you']]","[[], [[201892, 201895]]]","[[], [['Caroline Abbott']]]"
Q699,"No,","['No,']","[[201920, 201923]]",Caroline Abbott,['Signor Carella'],Explicit,said Miss Abbott,[[]],[[]],[[]]
Q700,"It is not necessary, Signor Carella. Since you are tired of the
baby--","['It is not necessary, Signor Carella. Since you are tired of the\nbaby--']","[[201999, 202069]]",Caroline Abbott,['Signor Carella'],Implicit,,"[['Signor Carella', 'you']]","[[[202020, 202034], [202042, 202045]]]","[[['Signor Carella'], ['Signor Carella']]]"
Q701,"I don t mean that,","['I don t mean that,']","[[202150, 202168]]",Caroline Abbott,['Mr. Herriton'],Anaphoric,she added,[[]],[[]],[[]]
Q702,"I know, Ah, in a foreign language (and
how perfectly you speak Italian) one is certain to make slips.","['I know,', 'Ah, in a foreign language (and\nhow perfectly you speak Italian) one is certain to make slips.']","[[202191, 202198], [202229, 202322]]",Signor Carella,['Caroline Abbott'],Anaphoric,was his courteous response,"[[], ['you']]","[[], [[202274, 202277]]]","[[], [['Caroline Abbott']]]"
Q703,"You meant that we could not always be together yet, he and I. You are
right. What is to be done? I cannot afford a nurse, and Perfetta is too
rough. When he was ill I dare not let her touch him. When he has to
be washed, which happens now and then, who does it? I. I feed him, or
settle what he shall have. I sleep with him and comfort him when he is
unhappy in the night. No one talks, no one may sing to him but I. Do not
be unfair this time; I like to do these things. But nevertheless (his
voice became pathetic) they take up a great deal of time, and are not
all suitable for a young man.","['You meant that we could not always be together yet, he and I. You are\nright. What is to be done? I cannot afford a nurse, and Perfetta is too\nrough. When he was ill I dare not let her touch him. When he has to\nbe washed, which happens now and then, who does it? I. I feed him, or\nsettle what he shall have. I sleep with him and comfort him when he is\nunhappy in the night. No one talks, no one may sing to him but I. Do not\nbe unfair this time; I like to do these things. But nevertheless (his\nvoice became pathetic) they take up a great deal of time, and are not\nall suitable for a young man.']","[[202389, 202982]]",Signor Carella,['Caroline Abbott'],Implicit,,"[['You', 'You', 'Perfetta', 'her', 'his']]","[[[202389, 202392], [202451, 202454], [202515, 202523], [202569, 202572], [202879, 202882]]]","[[['Caroline Abbott'], ['Caroline Abbott'], ['Perfetta'], ['Perfetta'], ['Signor Carella']]]"
Q704,"Not at all suitable,","['Not at all suitable,']","[[202986, 203006]]",Caroline Abbott,['Signor Carella'],Explicit,said Miss Abbott,[[]],[[]],[[]]
Q705,A little more wine?,['A little more wine?'],"[[203269, 203288]]",Signor Carella,['Caroline Abbott'],Explicit,asked Gino,[[]],[[]],[[]]
Q706,"Oh, no, thank you! But marriage, Signor Carella, is a very serious
step. Could you not manage more simply? Your relative, for example--","['Oh, no, thank you! But marriage, Signor Carella, is a very serious\nstep. Could you not manage more simply? Your relative, for example--']","[[203311, 203446]]",Caroline Abbott,['Signor Carella'],Implicit,,"[['you', 'Signor Carella', 'you', 'Your']]","[[[203325, 203328], [203344, 203358], [203390, 203393], [203418, 203422]]]","[[['Signor Carella'], ['Signor Carella'], ['Signor Carella'], ['Signor Carella']]]"
Q707,Empoli! I would as soon have him in England!,['Empoli! I would as soon have him in England!'],"[[203450, 203494]]",Signor Carella,['Caroline Abbott'],Implicit,,[[]],[[]],[[]]
Q708,"England, then--","['England, then--']","[[203498, 203513]]",Caroline Abbott,['Signor Carella'],Implicit,,[[]],[[]],[[]]
Q709,"He has a grandmother there, you know--Mrs. Theobald.","['He has a grandmother there, you know--Mrs. Theobald.']","[[203530, 203582]]",Caroline Abbott,['Signor Carella'],Implicit,,"[['you', 'Mrs. Theobald']]","[[[203558, 203561], [203568, 203581]]]","[[['Signor Carella'], ['Mrs. Theobald']]]"
Q710,"He has a grandmother here. No, he is troublesome, but I must have him
with me. I will not even have my father and mother too. For they would
separate us,","['He has a grandmother here. No, he is troublesome, but I must have him\nwith me. I will not even have my father and mother too. For they would\nseparate us,']","[[203586, 203739]]",Signor Carella,['Caroline Abbott'],Anaphoric,he added,[[]],[[]],[[]]
Q711,How?,['How?'],"[[203753, 203757]]",Caroline Abbott,['Signor Carella'],Implicit,,[[]],[[]],[[]]
Q712,They would separate our thoughts.,['They would separate our thoughts.'],"[[203761, 203794]]",Signor Carella,['Caroline Abbott'],Implicit,,[[]],[[]],[[]]
Q713,Wake up!,['Wake up!'],"[[204321, 204329]]",Signor Carella,['_unknowable'],Anaphoric,he cried,[[]],[[]],[[]]
Q714,"Oh, take care!","['Oh, take care!']","[[204466, 204480]]",Caroline Abbott,['Signor Carella'],Explicit,Miss Abbott cried,[[]],[[]],[[]]
Q715,"He is not much longer than my boot, is he? Can you believe that in time
his own boots will be as large? And that he also--","['He is not much longer than my boot, is he? Can you believe that in time\nhis own boots will be as large? And that he also--']","[[204544, 204666]]",Signor Carella,['Caroline Abbott'],Implicit,,[['you']],"[[[204591, 204594]]]",[[['Caroline Abbott']]]
Q716,But ought you to treat him like that?,['But ought you to treat him like that?'],"[[204670, 204707]]",Caroline Abbott,['Signor Carella'],Implicit,,[['you']],"[[[204680, 204683]]]",[[['Signor Carella']]]
Q717,"father-son,","['father-son,']","[[205413, 205424]]",Signor Carella,['Caroline Abbott'],Explicit,Gino pointed first to himself and then to his baby and said,[[]],[[]],[[]]
Q718,"This woman will do exactly what I tell her. She is fond of children.
She is clean; she has a pleasant voice. She is not beautiful; I cannot
pretend that to you for a moment. But she is what I require.",['This woman will do exactly what I tell her. She is fond of children.\nShe is clean; she has a pleasant voice. She is not beautiful; I cannot\npretend that to you for a moment. But she is what I require.'],"[[205626, 205826]]",Signor Carella,['Caroline Abbott'],Implicit,,[['you']],"[[[205782, 205785]]]",[[['Caroline Abbott']]]
Q719,"Oh, do take care! You are squeezing it.","['Oh, do take care!', 'You are squeezing it.']","[[205862, 205879], [205902, 205923]]",Caroline Abbott,['Signor Carella'],Explicit,begged Miss Abbott,"[[], ['You']]","[[], [[205902, 205905]]]","[[], [['Signor Carella']]]"
Q720,"It is nothing. If he cries silently then you may be frightened. He
thinks I am going to wash him, and he is quite right.","['It is nothing. If he cries silently then you may be frightened. He\nthinks I am going to wash him, and he is quite right.']","[[205927, 206047]]",Signor Carella,['Caroline Abbott'],Implicit,,[['you']],"[[[205968, 205971]]]",[[['Caroline Abbott']]]
Q721,Wash him! You? Here?,"['Wash him!', 'You? Here?']","[[206051, 206060], [206074, 206084]]",Caroline Abbott,['Signor Carella'],Anaphoric,she cried,"[[], ['You']]","[[], [[206074, 206077]]]","[[], [['Signor Carella']]]"
Q722,"I had gone to the Farmacia, and was sitting there
comfortably, when suddenly I remembered that Perfetta had heated water
an hour ago--over there, look, covered with a cushion. I came away at
once, for really he must be washed. You must excuse me. I can put it off
no longer.","['I had gone to the Farmacia,', 'and was sitting there\ncomfortably, when suddenly I remembered that Perfetta had heated water\nan hour ago--over there, look, covered with a cushion. I came away at\nonce, for really he must be washed. You must excuse me. I can put it off\nno longer.']","[[206341, 206368], [206385, 206631]]",Signor Carella,['Caroline Abbott'],Anaphoric,he continued,"[[], ['Perfetta', 'You']]","[[], [[206452, 206460], [206584, 206587]]]","[[], [['Perfetta'], ['Caroline Abbott']]]"
Q723,"I have wasted your time,","['I have wasted your time,']","[[206635, 206659]]",Caroline Abbott,['Signor Carella'],Anaphoric,she said,[['your']],"[[[206649, 206653]]]",[[['Signor Carella']]]
Q724,But why are you going? Excuse me if I wash him while we talk.,['But why are you going? Excuse me if I wash him while we talk.'],"[[207069, 207130]]",Signor Carella,['Caroline Abbott'],Implicit,,"[['you', 'we']]","[[[207081, 207084], [207122, 207124]]]","[[['Caroline Abbott'], ['Signor Carella', 'Caroline Abbott']]]"
Q725,"I have nothing more to say,","['I have nothing more to say,']","[[207134, 207161]]",Caroline Abbott,['Signor Carella'],Explicit,said Miss Abbott,[[]],[[]],[[]]
Q726,"Oh, but stop a moment! You have not seen him yet.","['Oh, but stop a moment!', 'You have not seen him yet.']","[[207382, 207404], [207417, 207443]]",Signor Carella,['Caroline Abbott'],Anaphoric,he cried,"[[], ['You']]","[[], [[207417, 207420]]]","[[], [['Caroline Abbott']]]"
Q727,"I have seen as much as I want, thank you.","['I have seen as much as I want, thank you.']","[[207447, 207488]]",Caroline Abbott,['Signor Carella'],Implicit,,[['you']],"[[[207484, 207487]]]",[[['Signor Carella']]]
Q728,Take him!,['Take him!'],"[[207591, 207600]]",Signor Carella,['Caroline Abbott'],Implicit,,[[]],[[]],[[]]
Q729,"I must go at once,","['I must go at once,']","[[207636, 207654]]",Caroline Abbott,['Signor Carella'],Anaphoric,she cried,[[]],[[]],[[]]
Q730,"Who would have believed his mother was blonde? For he is brown all
over--brown every inch of him. Ah, but how beautiful he is! And he is
mine; mine for ever. Even if he hates me he will be mine. He cannot help
it; he is made out of me; I am his father.","['Who would have believed his mother was blonde? For he is brown all\nover--brown every inch of him. Ah, but how beautiful he is! And he is\nmine; mine for ever. Even if he hates me he will be mine. He cannot help\nit; he is made out of me; I am his father.']","[[207728, 207980]]",Signor Carella,['Caroline Abbott'],Implicit,,[['his mother']],"[[[207752, 207762]]]",[[['Lilia']]]
Q731,May I help you to wash him?,['May I help you to wash him?'],"[[208737, 208764]]",Caroline Abbott,['Signor Carella'],Anaphoric,she asked,[['you']],"[[[208748, 208751]]]",[[['Signor Carella']]]
Q732,"It is very kind of you, especially in your beautiful
dress. He is nearly clean already. Why, I take the whole morning! There
is so much more of a baby than one expects. And Perfetta washes him just
as she washes clothes. Then he screams for hours. My wife is to have a
light hand. Ah, how he kicks! Has he splashed you? I am very sorry.","['It is very kind of you,', 'especially in your beautiful\ndress. He is nearly clean already. Why, I take the whole morning! There\nis so much more of a baby than one expects. And Perfetta washes him just\nas she washes clothes. Then he screams for hours. My wife is to have a\nlight hand. Ah, how he kicks! Has he splashed you? I am very sorry.']","[[209207, 209230], [209246, 209558]]",Signor Carella,['Caroline Abbott'],Anaphoric,he murmured,"[['you'], ['your', 'Perfetta', 'she', 'you']]","[[[209226, 209229]], [[209260, 209264], [209395, 209403], [209423, 209426], [209537, 209540]]]","[[['Caroline Abbott']], [['Caroline Abbott'], ['Perfetta'], ['Perfetta'], ['Caroline Abbott']]]"
Q733,"I am ready for a soft towel now,","['I am ready for a soft towel now,']","[[209562, 209594]]",Caroline Abbott,['Signor Carella'],Explicit,said Miss Abbott,[[]],[[]],[[]]
Q734,Certainly! certainly!,['Certainly! certainly!'],"[[209658, 209679]]",Signor Carella,['Caroline Abbott'],Implicit,,[[]],[[]],[[]]
Q735,And if you had any powder.,['And if you had any powder.'],"[[209832, 209858]]",Caroline Abbott,['Signor Carella'],Implicit,,[['you']],"[[[209839, 209842]]]",[[['Signor Carella']]]
Q736,Hullo!,['Hullo!'],"[[210761, 210767]]",Mr. Herriton,"['Signor Carella', 'Caroline Abbott']",Anaphoric,he exclaimed,[[]],[[]],[[]]
Q737,"No, do stop! I got your note. I m not offended;
you re quite right. I really want you; I could never have done it
alone.","['No, do stop!', 'I got your note. I m not offended;\nyou re quite right. I really want you; I could never have done it\nalone.']","[[210921, 210933], [210954, 211061]]",Mr. Herriton,['Caroline Abbott'],Explicit,whispered Philip,"[[], ['your', 'you', 'you']]","[[], [[210960, 210964], [210989, 210992], [211023, 211026]]]","[[], [['Caroline Abbott'], ['Caroline Abbott'], ['Caroline Abbott']]]"
Q738,"Signorina, do stop a little--after all your kindness.","['Signorina, do stop a little--after all your kindness.']","[[211162, 211215]]",Signor Carella,"['Mr. Herriton', 'Caroline Abbott']",Implicit,,[['your']],"[[[211201, 211205]]]",[[['Caroline Abbott']]]
Q739,What is it?,['What is it?'],"[[211242, 211253]]",Mr. Herriton,"['Signor Carella', 'Caroline Abbott']",Explicit,said Philip,[[]],[[]],[[]]
Q740,What is it?,['What is it?'],"[[211486, 211497]]",Mr. Herriton,['Signor Carella'],Explicit,asked Philip,[[]],[[]],[[]]
Q741,"Well, your business,","['Well, your business,']","[[211720, 211740]]",Signor Carella,['Mr. Herriton'],Explicit,said Gino,[['your']],"[[[211726, 211730]]]","[[['Mr. Herriton', 'Caroline Abbott']]]"
Q742,Our business--Miss Abbott has told you of that.,['Our business--Miss Abbott has told you of that.'],"[[211777, 211824]]",Mr. Herriton,['Signor Carella'],Implicit,,"[['Miss Abbott', 'you']]","[[[211791, 211802], [211812, 211815]]]","[[['Caroline Abbott'], ['Signor Carella']]]"
Q743,No.,['No.'],"[[211828, 211831]]",Signor Carella,['Mr. Herriton'],Implicit,,[[]],[[]],[[]]
Q744,But surely--,['But surely--'],"[[211835, 211847]]",Mr. Herriton,['Signor Carella'],Implicit,,[[]],[[]],[[]]
Q745,She came for business. But she forgot about it; so did I.,['She came for business. But she forgot about it; so did I.'],"[[211851, 211908]]",Signor Carella,['Mr. Herriton'],Implicit,,"[['She', 'she']]","[[[211851, 211854], [211878, 211881]]]","[[['Caroline Abbott'], ['Caroline Abbott']]]"
Q746,"Mad! absolutely stark, staring, raving mad!","['Mad!', 'absolutely stark, staring, raving mad!']","[[212169, 212173], [212195, 212233]]",Harriet,['Mr. Herriton'],Explicit,screamed Harriet,"[[], []]","[[], []]","[[], []]"
Q747,"What s she here for? Answer me that. What s she doing in Monteriano in
August? Why isn t she in Normandy? Answer that. She won t. I can: she s
come to thwart us; she s betrayed us--got hold of mother s plans. Oh,
goodness, my head!","['What s she here for? Answer me that. What s she doing in Monteriano in\nAugust? Why isn t she in Normandy? Answer that. She won t. I can: she s\ncome to thwart us; she s betrayed us--got hold of mother s plans. Oh,\ngoodness, my head!']","[[212285, 212516]]",Harriet,['Mr. Herriton'],Implicit,,"[['she', 'she', 'she', 'She', 'she', 'us', 'she', 'us']]","[[[212292, 212295], [212329, 212332], [212374, 212377], [212404, 212407], [212422, 212425], [212443, 212445], [212447, 212450], [212462, 212464]]]","[[['Caroline Abbott'], ['Caroline Abbott'], ['Caroline Abbott'], ['Caroline Abbott'], ['Caroline Abbott'], ['Mr. Herriton', 'Harriet'], ['Caroline Abbott'], ['Mr. Herriton', 'Harriet']]]"
Q748,"You mustn t accuse her of that. Though
she is exasperating, she hasn t come here to betray us.","['You mustn t accuse her of that. Though\nshe is exasperating, she hasn t come here to betray us.']","[[212551, 212645]]",Mr. Herriton,['Harriet'],Anaphoric,He was unwise enough to reply,"[['You', 'her', 'she', 'she', 'us']]","[[[212551, 212554], [212570, 212573], [212590, 212593], [212611, 212614], [212642, 212644]]]","[[['Harriet'], ['Caroline Abbott'], ['Caroline Abbott'], ['Caroline Abbott'], ['Mr. Herriton', 'Harriet']]]"
Q749,Then why has she come here? Answer me that.,['Then why has she come here? Answer me that.'],"[[212649, 212692]]",Harriet,['Mr. Herriton'],Implicit,,[['she']],"[[[212662, 212665]]]",[[['Caroline Abbott']]]
